|Suiting and Ingress
Evans|Terminator photos - Hopefully, those are going to come out. I used a lot of Nikon film for terminator photos. We should have a lot of 35 mm stuff that was not planned or not scheduled in the Flight Plan. We used the Nikon with a red filter and a blue filter and took three shots with the red filter and three different shots with the blue filter of the landing site area. We also used two different polarizing filters in one direction and then in the other direction. That information should be in the Flight Plan. In each case, the zodiacal light with the filters worked out real fine. The timing and the settings worked correctly. I've got it noted in the experiment checklist that I had the wrong setting for half a second. I ended up on the 1-second mode. I think that was in the polarizing part. In any event those pictures should be good. In sketching the zodiacal light as you come up to the spacecraft sunrise, I think we probably didn't get the longest streamers that are just half a second or quarter of a second prior to the Sun popping over the horizon. In each case of the zodiacal light passes, the sequence ended 7 to 10 seconds prior to spacecraft sunrise. I think we probably missed the longest streamers. I didn't really observe this phenomena until the last day of lunar orbit and didn't have the opportunity to take a hand-held target of that particular phenomena.
Evans|Solar corona - The sequence worked real fine, no problems.
Evans|Earthshine photography - We worked it differently than it is indicated in the experiment checklist. I used Aristoteles and Copernicus starting out with a 1 second and taking two 1-second exposures. As we rotated around about every 30 seconds, it ended up a little closer than I thought. We were passing up the target too fast because we'd never get every- thing. The timing sequence may not be correct. It may not be exactly 30 seconds between each one. We would cycle down the exposure setting to 1 second, 1/2 second, 1/4 second, 1/8 second, and 1/16 second on Aristoteles and Copernicus. We'd leave it on one-sixteenth of a second following Copernicus and switch over to window three and pick up Reiner Gamma and do the same type of sequence. Then we stopped on 1/8-second exposure and carried it out until the end of the film mag.
Evans|Orbital science photography - It worked according to the Flight Plan We would have the initial setting, and on the orbital monitor charts, we would have the inpoints and then pick out specific craters and have these noted on the chart as to change settings. I did notice that it is very easy to bump and change the camera settings as you bounce around in the spacecraft - trying to keep track of the camera pointing as you try to maintain your own equilibrium. A couple of times at the end of a particular sequence, I noted that it had changed from what I had started with. The orbital science photography was accomplished with no particular problems other than trying to maintain a constant camera setting. We had two magazines of what we call CM option or option-photography colored film. Those two magazines were completely filled up with just targets of opportunity.
Evans|Plane change 1- I previously mentioned the trim burn part of plane change 1. Plane change 1 was a little larger than anticipated because of nondecay of orbit, Plane change 1 is where I had 0.7 ft/sec and it seems to me like an X. I did not trim it because we were only trimming Y. There was also a plane change where I ended up with a different roll because the pan camera was looking right into the Sun. No real problem. If I were going to trim anything, I would trim Y and Z just to make sure I didn't perturbate the apogee and perigee orbit. To keep the pan camera out of the Sun, I went into P40 trim and utilized that roll angle. Communications were outstanding. Maneuvers done to support the lift-off presented no problem.
Evans|Rest and eat periods - I never got to sleep on time. It just took a great amount of time for one man to go through that Presleep Checklist - to go down and chlorinate the water, take the panel off, pull the return valve and clean the hoses - it just takes a lot of time to get it all done. But, there's no real problem.
Evans|TPI backup - My TPI solution agreed quite well with the Challenger, no problem.
Evans|Midcourse backups - I ran into a bit of a problem. I ended up with 5 ft/sec as a Z-value, and the LM ended up with 1 ft/sec, I don't understand why there's that much difference between the two midcourse solutions. Of course, the Challenger made all the burns during rendezvous and braking, so I didn't have any problems there.
Evans|Prep for docking - There is no time to get all the cameras and things squared away prior to going into rendezvous, so I strapped the TV monitor to the XX strut by the CDR's couch and utilized it during the rendezvous and braking phase or final phase of the burn. I used a P79 to point the X-axis out the LM. And once it got close, I essentially pointed the spacecraft such that the LM was always in the center of the TV field of view while coming in for docking.
|Lift-Off, Rendezvous and Docking

Cernan|LM powerup and launch preparation went well. We did not do the P22. Everything else just went as advertised on the LM. She powered up beautifully. The lift-off was normal. Obviously, we got all our pyros, and we lost no changeover, Parker valves, or anything. Very soon after lift-off, we had apparent loss of comm, a lot of noise in the S-band. It turned out that we were down-linking, but there was something wrong with the up-link. So the CDR watched most of the guidance and would call out, in the blind, altitudes and GOs and what have you as we pitched over and pressed on up. For about the first 2 or 3 minutes, the lunar module pilot had to concern himself with trying to get comm back.
Schmitt|Apparently , Goldstone dropped the up-link. When they were getting it back, I was switching omnis, and for a while there, it was just completely out of phase. They had a continuous down-link on us.
Cernan|It was a very inopportune time, I might say, because it happened just right after ignition. I think that's something, though, that the INCOs are going to be able to clarify. We certainly can't give you the details. It's just that there was essentially no comm on all the antennas.
Cernan|We flew into a trajectory that appeared to be nominal. The AGS showed us slightly out of plane. As a result, our tweak at 9 ft/sec was minus 4, minus 9, and plus 1. We burned out X, Z, Y, in that order.
Schmitt|It was about 7 ft/sec, a little over 7 ft/sec.
Cernan|It looked like we might have had a g-sensitive drift in our Y-accelerometer in the PGNCS. The tweak was excellent because our rendezvous was just as nominal a rendezvous and as nominal a trajectory profile as I've ever been involved with. The drift in accelerometer did not bother us anywhere else in the tracking or in the rendezvous at all.
Cernan|Rendezvous navigation followed the checklist; we got right off the form very well. We got all the updates into the AGS. The residuals in the TPI burn were greater than what I had expected. We did not record them because I wanted to get them nulled out just as soon as possible. I don't know the tenths, but they were minus 7 in X, and they were 14 and 4, and I'm not sure whether they were plus or minus in Y and Z. They were large, larger than I'd expected. They were minus 7 and 4-point something and a 4-point something. We reduced those to less than 0.2 ft/sec. From then on, we continued to plot right through the midcourses right up the pike on a nominal trajectory.
Schmitt|The comm was good. I have a couple of comments about the AGS. Early after insertion, I always checked the accelerometer. They looked real good. About 5 or 10 minutes later (I can't remember exactly) , I looked and I'd accumulated maybe a foot and a half per second in X. I did a gyro cal, and after that, there was no significant accumulation in X. It went very well. I did that without talking to the ground, but I felt I had an understanding with them on that.
Schmitt|On the TPI solution, the AGS was essentially within 2 or 3 ft/sec, a good TPI solution after six marks. The insertion solution was not very good. It was off by a number of feet per second in X and even more in Z. This was the first one of 17 marks. The PGNCS recycle and PGNCS final were very close, within a couple of feet per second.
Cernan|Midcourse Solutions - The first midcourse solution agreed effectively all systems, except AGS out of plane was a little bit high. The decision was made to burn the onboard PGNCS solution out of the LM, which was minus 1.2, plus 0.4, and plus 0.3. We continued to track right up the pike. Midcourse 2 came up, and we again prepared all the solutions. The AGS out of plane was still a little bit high and actually in the opposite direction from the PGNCS. We had a slight variation in the CSM solution in Z. I don't know why. It came up with plus 5.4 ft/sec in Z. So we really didn't get a very good correlation between the CSM and the LM on the second midcourse. But the PGNCS was still performing, the radar was still performing, and based upon our trajectory plot and based upon our following a nominal inertial line of sight rate, we decided to burn the onboard PGNCS solution in the LM. It was minus 0.4, minus 0.7, and minus 1.6.
Cernan|From there on out, we just continued to follow the inertial line of sight angles. There was very little tweaking in either Y or Z. We just sort of floated right through the braking gates. At 1 mile, I think we took about 6 or 7 ft/sec off to hit 30. We met all the gates as prescribed and just came moving very slowly into the final stationkeeping.
Cernan|We went into a formation flight around the CSM. We got a good inspection of the spacecraft and the SIM bay, the report of which is in the transcript. Everything looked good to us The command module maneuvered to the docking attitude. The LM just took its docking attitude, gave stationkeeping control to the command module, did pitch and yaw maneuvers, and stood by for docking.
Evans|One of the noticeable differences between this docking and the docking with the S-IVB is the fact that the ascent stage did dance a lot more than the S-IVB did. The S-IVB is steady as a rock. The LM dead band would change attitude, and you'd try to follow it. On the first attempt, I must have had less than 0.1 ft/sec, just barely closing. I was just taking it nice and easy. We made contact and did not get capture. As soon as we didn't get capture, it was obvious we were closing too slowly. We backed off a couple or 3 feet, renulled the rates, initiated the closing rates, and got capture. As soon as we got capture, both vehicles went to CMC FREE I looked out, and I had some rates in the Old and I'm sure that the LM had rates also. He must have had.
Cernan|We went FREE Upon capture, the LM went FREE The CSM trying to null the rates ended up perturbating the LM and giving us rates.
Evans|We finally gave up on that mode and had the LM go to ATTITUDE HOLD. Once you get ATTITUDE HOLD, the CSM could null the rates. We got it lined up and attempted the hard docking. There was no problem. The probe retract came back. This time, it didn't sound like it was as much of a ripple fire. It was more of a "phhtt." It was a quicker hard dock than it was the previous time.
Cernan|I want to say something about the visual sighting during rendezvous. From the LM, I was able to see the command module when it was sunlit at somewhere around 100 miles. I definitely defined that that was the command module. After the command module went into darkness, I could not pick up his tracking lights until we were well within about 40 miles. I could not pick up the docking light, the rendezvous light, of the command module until we were well within 40 miles. It was initially a very dim, faint flash. I was able to verify on board that the LM tracking light was working. I finally figured out how; it was reflecting off the underside of the EVA handrail on the left forward side of the LM. I could see the LM tracking light flashing. There were some particles we took with us that stayed with the spacecraft, and you could see the sequential flash off the particles as the result of our LM tracking light.
Schmitt|Regarding the television and photography from the LM, we'll just have to wait and see how it turned out. I took a lot of footage. We put it on not only the ascent mag, but we put it on the other mag. That includes the SIMbay. Right or wrong, we did have a Hasselblad on board, so we have a lot of Hasselblad photography.
|Lunar Module Jettison Through TEI

Cernan|Postdocking Check and Pressurization - The general comment I want to make about the postdocking operations is that both pilots in the LM took their helmets off to keep the dust off, primarily. The commander took off his gloves almost immediately after insertion, and flew the entire rendezvous that way. Jack took his off some time later.
Schmitt|I kept mine on for some time. I can't remember exactly when I took them off. I did most of my preinsertion work with the gloves on, because I didn't want to take the time. I wanted to get that initial AGS solution. I could get that fairly rapidly with the gloves. I didn't take the gloves off until maybe 10 or 15 minutes after insertion. I kept the helmet on all the way through most of the transfer, just to avoid breathing the dust. I had the sinus irritation on the surface.
Cernan|The commander kept his helmet on throughout the rendezvous and docking. I took my gloves off after insertion and left them off. As soon as we were hard docked, the commander took off his helmet. As I look back at that, because of the dust debris in the LM spacecraft, I'm sorry I did. I could have left the helmet on, and I would have had a lot less eye and mouth type of irritation. You knew you were in a very heavily infiltrated atmosphere in the LM because of the lunar dust. I don't know how much lunar dust previous flights had, but I think we saved a great deal of grief by sweeping all the dust we could find on the floor into the holes and putting our tape covers over those holes. I think that had to help a great deal. There was an awful lot of dust on the floor that we didn't see.
The commander had his helmet and gloves off all throughout the entire transfer. We handled the transfer the way we'd planned. The LM pilot did most of the preparation of the gear in the LM, and the commander stayed in the tunnel and passed things on. The inventory was going on in the command module side and on the LM side, both. We vacuumed each other's suits the best we could and everything else that got supposedly transferred, unbagged, or uncovered.
Schmitt|In spite of the CMP's comments to the contrary, I think we got things remarkably clean. There wasn't an awful lot of dirt in the command module coming back.
Evans|That's true.
Schmitt|In contrast, he may have thought it was dirty, but I was surprised we were able to keep the level of contamination in the command module down.
Cernan|After I took my helmet off, I could go halfway through the tunnel and stick my head up in the command module, and it was a totally refreshed, unpolluted atmosphere up there. It never did get polluted.
Schmitt|I think having that vacuum cleaner running in the LM had a lot to do with keeping the flow in the other direction, filtering out the air.
Evans|We never did vacuum in the command module because it just wasn't necessary.
Schmitt|The suits were noticeably cleaned by the vacuum cleaner. You could tell you were pulling stuff off them, although they were still dirty. Every subsequent time we handled them, we got our hands dirty. I think most of the free dust was taken care of.
Cernan|We effectively stayed on the transfer list. I say effectively, throughout the transfer. However, some things got transferred out of order and temporarily stowed in the command module. We effectively used the transfer list not as a cookbook recipe type of thing, but as an inventory list. We inventoried it several times from both ends and were satisfied we had everything transferred. We then pressed on with the LM closeout.
The LM closeout went nominal. We got back into the command module, and the LMP closed out the LM. For convenience, the commander went back and closed out the LM hatch and put in the command module hatch. Because of the slow tunnel vent, or the long duration of tunnel vent, the commander stayed in the tunnel, the LMP in his seat, and the CMP in the left seat. We suited up and prepared for our integrity check. As soon as the LM tunnel vent was complete and we were satisfied with the integrity of the hatch, we went into the suit integrity check.
Evans|I bet it must take at least three or four times longer than the simulator did for the tunnel vent.
Cernan|I think that's going to be applicable to Skylab. They're going to have to vent before they undock, I think.
The tunnel closeout was easy. We had no drogue and probe which were stored in the LM for LM jett. We just followed the checklist, and it all seemed to happen just as advertised.
Evans|We got a little bit intrigued with the LM jettison. It was great. It just sailed out there nice and pretty, and we got a lot of good pictures of it. We should have been maneuvering. We ended up getting into P41 after jettison for sep burn, a little bit late. That was no problem either, because we just trimmed the residuals for P41 and got a good sep burn.
Cernan|Cleaning control in the command module was excellent, considering all the dust and dirt that just seemed to adhere to everything in the 1M. When we got back in the command module, with the exception of the suits, and LMP and CDR, everything was clean. Everything was clean because everything was bagged before we brought it over - bagged and zipped. We never did open anything once we got it zipped up. So the command module stayed exceptionally clean throughout the remainder of the flight.
Schmitt|In the bagging of the decontamination bags, I made a special effort, after requests prelaunch, to pull those zippers as tight as I could. They should be pretty tight.
Evans|High gain always worked good; omnis and S-band were good. Photography went as advertised. We had lots of targets of opportunity. SIM bay operations have been mentioned before.
TEI updates, normal. Sextant star checks were good for TEI.
Cernan|Every one all through the flight was good, which made me feel real good. I made sure I got it on those last few. I wasn't going to change any mode of operation. I made sure I got it on TEI. Just to make you guys feel at home. I figured you'd think I didn't do it right, if I didn't get the master alarm.
Schmitt|The TEI, at 1/2g, or whatever we were pulling there, seemed like more than that.
Evans|It sure did; it seemed like it was really pushing you back in the seat.
Schmitt|Ron and I both started out holding our heads up and eventually relaxed them back on the couch.
Cernan|I guess we must have had the spacecraft pretty well stowed, or tied down. I briefed the CMP and LMP, and, as I recall, those kind of burns back on Apollo 10, lots of things start moving through the spacecraft and find their way to the aft end of the spacecraft because of the g-load. Much to my surprise, all we had was an initial thud as we moved away from the station, and we didn't have any gear flying through the spacecraft.
Schmitt|I found a white tag, wetwipe.
Cernan|Other than maybe one or two of those things, in looking back, I would have expected more gear to come from somewhere, but we prepared for those burns pretty well.
Evans|That reminds me of all this water condensing on the ECU unit, the pipes, and what have you. When we put our suits on for the EVA the next day, your suits were noticeably wet. When I pulled the PGA bag up, it was damp down underneath the PGA bag. As a normal procedure, we should have, either after the burn, probably before the burn, made sure we wiped up the water in the LEB.
Cernan|Our suits were damp when we put them on, but I could not find any real water down there.
Evans|There's always water down there in the ECS. I just assumed that's where all of it came from. There's not a puddle of water. Like I said, it's just damp.
Cernan|It's almost as if it was colder down in the LEB, and water was condensing all over the suits. It wasn't as if they were in a puddle.
Evans|The simulator is set up such that in roll dead band, it goes over to one side of roll dead band and just kind of stays there. During the TEI burn, it was bouncing back and forth from one side of the dead band clear over to the other side of the dead band. When it's bouncing back and forth, the roll rate is up around, oh, 0.4" per second, arcing back and forth across the roll dead band.
I'd like to mention chlorination at this point.
Cernan|Without fail, almost every chlorination leaked. Sometimes large quantities of water, other times just small quantities of water.
Evans|Water or chlorine?
Cernan|A combination. Where it leaked appeared to be around the bag. It was the cylindrical chlorine dispenser that was continually wet. It was not where the dispenser fit into the needle or where the needle adaptor fit into the spacecraft. It was within the chlorine dispenser itself. Chlorination was a case of always cleaning your hands with chlorine because you always had it available down there within that dispenser. In some cases, you had a larger quantity of water that had to be wiped up with a tissue. That plagued us throughout the whole mission. It turned out not to be a serious problem because we learned how to handle it. That was one system anomaly that hadn't really been brought up.
Evans|In two cases, I'm almost positive, it did not puncture the ampule. The reason I believe that's correct is that, when you started to crank the outside of the cassette down to push the chlorine into the water system - it was very hard to turn. If you tried to force it, you could force it on down there, and I'm sure that's a good way to break an ampule on the thing. In two cases, we took the bayonet fitting loose again and put it back on there, and in both cases, then you'd start to squeeze the chlorine out of the ampule into the system, and it would turn easier.
Cernan|We got the chlorination done. We didn't miss any injections of chlorine, and we didn't miss any of the buffer samples. I guess we got the job done; it was just a little bit messy. The chlorine was evident because the CDR eventually peeled all the outer skin off his right hand. I'm convinced it was due to the chlorine, and had nothing to do with the EVA.
14. Transearth Coast

Cernan|Passive thermal control was what I would call unusual attitude because of the UV/IR requirements. These unusual attitudes did two things. They required us to remaneuver the spacecraft several times and enter and exit PTC several, several times, which, in itself was not a problem, just additional coordination. Coincidentally, most of these particular PTC attitudes were within 30°, certainly 45°, of gimbal lock most of the time. We were looking at the red apple a good portion of the trip home.
Some of those attitudes where you actually were in attitude or PTC in these relatively unusual positions, change the equilibrium heat load on the spacecraft. RCS quad temperatures were all right, but you could see it in helium package temperatures and, most noticeably, you could see it on the change in condensation from the tall hatch to the forward hatch. The tall hatch eventually, for most of the way home, ended up to be very dry. The second day out on the way home, the center hatch got soaking wet to (the) point that we even took a dry rag and wiped off some of the latch components and some of the gearbox components, externally. Not that it did much good, but there was just that much water on there. I think this is all due to the PTC attitudes required for the SIM bay experiments on the way home.
Schmitt|It was cold in the spacecraft, too.
Cernan|Oh, yes, it was cold in the spacecraft.
Schmitt|Not as cold as the commander thought it was.
Cernan|Cold enough to warm it up, on the commander's orders.
Schmitt|We mentioned we warmed it up on the ground's suggestion of an extra inverter and going to MANUAL on the temp gain. I think we discussed that.
Cernan|Ron, all your REFSMMAT changes, your platform torquings , all those went very well, I thought.
Evans|They were great, went really well.
Cernan|All the way back home, it was just changing attitudes, changing attitudes, changing attitudes, with the exception of the EVA day, which we'll cover here shortly.
Evans|CSM EVA - On EVA prep, we really didn't have any problem. We didn't know of any at that point. The EVA prep went right down the line, essentially. It was well laid out within the experiments checklist. We checked things off as we went, and stayed pretty much on the timeline. We started about a half hour early, and finished a half hour early.
Cernan|We were a half hour early throughout the whole thing, and we lost that half hour in opening the hatch. We turned out to be exactly on time. Where we lost that half hour was on a comm carrier change.
Post-EVA - One thing that helped us immensely on what ended up to be, I think, a very fine entry stowage was that we backed off after EVA and took a good long look at the long-range stowage as well as the post-EVA stowage. We really started housecleaning, cleaning up the cabin, and effectively stowing some of the articles that were not going to be used any further in the mission for entry at that time. Our entry stowage really started with the EVA timeframe period, and I think that really helped us out in the long run.
