|Suiting and Ingress
Cernan|This may be an appropriate place to content on how we handled the lunar orbit phase with three men in the spacecraft. After the first 2 hours in the spacecraft, we figured out the most expeditious and efficient way of handling it and it worked that way throughout the rest of the flight. The CDR got in the left seat, where he belongs anyway and took the Flight Plan. Windows 5, 4, and 3 point towards the lunar surface so I let the orbital geologist and the surface geologist look out the windows and make all their finds. I kept them honest on SIM bay, made all the attitude changes that were required, and kept them up to date on all SIM bay switch changes. I ran the spacecraft, they did the orbital geology, and I kept them honest. I kept out of their way. I stayed on my side of the spacecraft, kept the systems and the world honest and they cut loose. That's the way I'd recommend doing it all the time. You didn't bump into each other. Occasionally I would sneak a peek and say they were right or wrong and let it go at that.
Evans|Level of details provided in onboard documentation/recommendation changes - Solo phase - I have no recommended changes. It was in outstanding shape. We had gone through it before and checked it out in the simulator.
Cernan|I want to comment under miscellaneous. I think the Flight Plan carried just enough detail to tell you what was going on and what was going to happen. If you were not familiar with the details of the operation of that particular system or what you were going to do in terms of going into PTC or any other phase in the mission it would refer you to the Systems Book or G&C Dictionary. You did not have to repeat them in the Flight Plan. I like this way of doing things. We generally had the Flight Plan plus two other documents out. One was a Systems Book and the other was probably a G&C Dictionary.
Evans|We kept the G&C dictionary out. In the solo phase, I had the Experiments Checklist out, too.
Schmitt|The Flight Plan was excellent. We had no problems with it at all that I'm aware of. Tommy Holloway and his people are to be complimented. The number of different requirements and experiments and general operational items that were required to be integrated was very very high. It was done in an extremely competent and usable way. I can't think of anything that I would change in the way that the Flight Plan was written.
23.5 Preflight Support

Evans|Good.
Cernan|Updated properly. This is both LM and CSM.
Evans|The CSM had no problem. We would give the information to the people at the Cape and they would make the changes in the CSM and quarters copies. We had them in a timely manner. Coordination was good between the Cape: and Houston.
Change propulsion system - There were very few changes in the checklists themselves once you came out with the primary book. There were few changes after that.
Real time procedures changes - They were quite nominal and from the CM standpoint easily taken care of.
Cernan|As far as I'm concerned, the LM preflight support on the Flight Data File was excellent. If there's anyplace that I'd make a comment on it was the fact that somehow the latest changes we thought were in a system somehow never got in until the morning of the sim. They were always there for the sim.
Real-time procedural changes in the LM - There were really none except for the EVA. In the command module, they were so minimal that it was no problem updating the Flight Plan as we went along. I might add that the clock sync was so smooth that you wouldn't even believe it. It went "zap," we updated our clocks, and we were on our way. That put us right on the Flight Plan and that's probably one of the smoothest ideas anyone ever had.
Schmitt|Excellent in the Flight Data File area. One specific item that I had was two or three briefing sessions on portions of the lunar orbit during which I was in the CSM spacecraft. We went over in detail the attitudes, maneuvers, and the window availabilities so that I was able to plan in a very short amount of time with minimum effort my part for my own personal observations of the lunar surface. I appreciated that extra above and beyond the call of duty on the part of the flight planners. I appreciated their taking time out to do that for me.
I think it was useful to have the sessions where the flight controllers, the crew, and the flight planners met and went over those portions of the Flight Plan which were not normally simulated. I was a little bit disappointed in that some of the people who would be eventually intimately involved in the mission were not at the Flight Plan review.
24. Visual Sightings

Cernan|Countdown - It was dark and we didn't see anything until S-IC ignition, The CDR and the CMP could see out their small windows in the BPC the glow of ignition prior to lift-off.
Powered flight - During the actual powered flight of the S-IC you could not see anything at all. You couldn't see out the cockpit, as we had the lights up fairly bright. At staging, the S-IC shut down, something that you don't see in the daylight is that the fireball overtook us.
Evans|It sure did.
Cernan|When the S-II lit off, we literally for a nanosecond flew through the bright yellow fireball that was left over from the S-IC. Tower jett was very evident. You could see the flash and I could see the entire BPC. I could see underneath it. It was lit up underneath. The whole thing was lit up. I could see nothing on S-II until S-II shutdown. I could see the glow of S-IVB ignition. I say the glow of S-IVB ignition, it very easily could have been the fireball of S-II which tried to overtake us but couldn't quite make it. But there was a glow right during the period of S-II shutdown to S-IVB ignition. During the S-IVB burn, you could see the glow of the aft engines throughout the burn and throughout the orbital [operation?]
Earth orbit - I might comment that the availability of stars for a mode II or mode IV abort was pretty poor for two reasons. Number one: night adaptability because we had lights very bright. When we turned the lights down in the cockpit, I could not pick out distinct constellations such as Orion, which I was planning on using for a mode IV abort. If we would have had an SCS and G&N problem it would have been very difficult to pick out stars for that abort.
Evans|I should mention in Earth orbit you couldn't see the stars in the telescope in the daylight but they showed up nice and bright and clear in the sextant. I think that is probably a typical thing.
Cernan|When we burned out of Earth orbit, we started the burn in darkness and flew right on through a sunrise during the TLI burn. This was pretty spectacular. We shut down in daylight and had no other visual sightings at that point in time.
Translunar/transearth - After CSM separation from the booster and docking with the LM several hours later, we could see something which may have been the S-IVB or SLA panels. As soon as we turned around for docking I could see three of the four SLA panels tumbling slowly in space. This is not unusual. That's been seen before.
Evans|I never did see a SLA panel.
Cernan|There seemed to be an awful lot of particles with us continually throughout the flight, both in transearth and translunar coast and in lunar orbit. These particles were obviously residue from the RCS. Others were from dumped residues. They seemed to be hanging around the LM as a result of pulling in and out of the S-IVB and they were always small particles. Some, initially, were pieces of Mylar from the S-IVB LM separation. The others were just like small dump crystals or residue. On the LM, particularly, when you fire the RCS you could see the RCS residue.
Evans|That residue from the RCS didn't look a lot different than a waste-water dump.
Cernan|That's right, except that it's less dense.
Evans|Entry - Just the fireball, and the fireball is a lot brighter than I thought it was going to be. I almost wish I would have had sunglasses. It was really bright out of the rendezvous window just shortly after the .05g when you start picking up the greatest portion of the fireball. That brightness only lasted for maybe 30 to 40 seconds. Then either you became accustomed to the brightness or the brightness decreased. From that point on, I could see the instrument panel. Long after the brightness of the fireball decreased, I could look back up through the rendezvous window and see what to me was kind of like a tunnel with a bright spot in the middle of the tunnel. Way down the tunnel, way back behind, I could see the fireball.
Cernan|The only unusual sighting I can recall during landing or recovery is when the CMP looked out the window and saw the superstructure of an aircraft carrier and said, "Oh, we've got a tin can with us."
Evans|Well, it was kind of foggy on the windows.
Schmitt|Transearth we had only a small crescent of an Earth and it was not feasible to do any extensive weather observations. We had light flashes just about continuously during the whole flight when we were dark adapted. I had one which I thought was a flash on the lunar surface. That one period of time when we had the blindfolds on for the ALFMED experiment there were just no visible flashes, although that evening, that night, before I went to sleep I noticed that I was seeing the light flashes again. So, it just seemed to be that one interval either side of it where the light flash was not visible to myself or to the other two crewmen.
25. Premission Planning

Cernan|Mission plan - A lot of work went into the mission plan, with the right people. I think we came out with a mission plan and a Flight Plan which was not just a suitable one that would accomplish a purpose, but was a suitable one to be able to fly.
Evans|The mission plan was taken care of by a lot of people. The flight planning crew insured that everything in the mission plan was taken care of. And I did not have to participate in that part of it at all.
Cernan|Procedural changes - I think in my experience on past flights, procedural changes were held to a minimum. I think they were held to a minimum because we resisted a great many of them, particularly in terms of the lunar surface activities. Procedural changes if we would have allowed them to infiltrate the system, would have been with us right up to launch date. We put a cutoff on those several weeks before launch, accepted a few of them, and then forcefully would not accept any unless absolutely mandatory after the last 3 weeks. That was the key to keeping that Flight Plan and the lunar surface procedures intact.
Mission rules and techniques - I don't think these changed from any of the previous flights.
Evans|I don't think so either.
Cernan|They were in good shape and followed quite well. The only place we exercised a slight different approach in mission rules was the fact that we had a DOI- 1 which did not take us down to the minimum altitude that we had gone to in the past and then a DOI-2 in the LM.
Evans|Let me go back to the Flight Plan here. I think this was the first time we've ever tried this from the command module standpoint anyhow. This was that each person responsible for a section of the Flight Plan, whether it was from LOI to DOI or DOI to circ, was brought down to the Cape and utilized on the simulator console while I or the backup crew ran through the preliminary Flight Plans before they were even in the print stage. We essentially were debugging their part of the Flight Plan. They could see the problems involved and we worked together to get a good plan. This took a day to a day and a half at a time. I think it was well worthwhile.
Schmitt|There were periods of some difficulty, preflight particularly, in the area of medical requirements and in some last-minute possible scientific requirements particularly on the samples, but everything seemed to get resolved satisfactorily. I can't think of anything that was not handled very well by the support crew, Bob Parker in the science area, and Gordy Fullerton and Bob Overmyer in the operational areas. I guess the biggest single area that took time was the CMP's dealings with the lunar sounder. Most of our ALSEP changes were all taken care of prior to our training. We had a few minor suggestions, but they were taken care of early in the training cycle.
Mission rules and techniques were fairly well defined very early by Phil Shaffer and his crowd in the techniques area. The mission rules as defined by Jerry Griffin and his people were all in the right direction in that they enhanced the probability of making a landing in a successful mission. We really never had to exercise any of the mission rules in an abnormal way. I think that the one time that a mission rule tended to be a controlling factor was in the limitation on the work at station 4, Shorty Crater. We were up against the walkback constraint and terminated that work after only 35 minutes. Another 30 minutes there would have been extremely valuable. I hope that we got enough information on the phenomena exposed at that crater that can be understood.
26. Mission Control

Cernan|I think the GO/NO GOs and the performance of the CAPCOMs was outstanding. They gave us each GO, both CM and LM. There were no NO GOs, so we received all GOs. Everything was nominal. We received our updates on time. I don't think there was any concern or problem there. Consumables in both vehicles were nominal or better than nominal.
Oxygen - We had plenty of oxygen in both vehicles.
Electrical power - We had plenty of electrical power in both vehicles.
The RCS fuel in the service module was well above the red line for the entire first part of the mission and at or above the red line the last half of the mission. We went in on double ring in the command module and we couldn't have used very much.
Evans|I used more fuel than I would have in the simulator because there were always some rates; cross coupling in pitch and yaw in the command module RCS.
Cernan|LM RCS - We landed with more RCS than I'd ever seen in simulator, well over 80 percent, which made me feel good.
DPS propellent - We landed with between 7 and 9 percent, which is far more than I'd ever seen in the simulator.
SPS fuel - I think came out just about right on the money. We did not make any SPS midcourses on the way home and we had about 3 percent in each side.
The key to the Flight Plan and the key to a smooth operation of the SIM bay in lunar orbit with all three individuals in the spacecraft was the fact that real-time changes were held to a minimum. The Flight Plan was so well thought out and was working so well that real-time changes were very simple, explicit , and not time consuming.
Evans|It was an outstanding way to run a flight. Communications were always good.
Cernan|The only communications problem we had in the LM was right after ascent when we lost the high gain where the ground could hear everything we said. We had a lot of noise and static in the background and we could not hear anything that the ground said until about 3 minutes into the flight.
Schmitt|Typically outstanding support. The number of extracurriculum hours the LM people and the EECOMs for the CSM in particular put in with me on Saturdays and other times just talking over systems, techniques, and mission rules were a major factor in helping me understand and keep up to speed. The help that they gave me in designing the emergency cue cards for the LM was a major contribution although we did not use them. Had we required them I think it would have gone very well. I want to point out that Dick Thorson was instrumental in organizing the LM and joint CSM/LM sessions. He was a major organizer for the creation and the updating of the emergency cue cards.
It was my understanding that some of the things I had hoped could be done during the flight were not possible because of real-time discussions in the Mission Control. Specifically, one of those things was to have a summary of the thinking of the science personnel in the back room given to me while in flight. The thinking was to be based on the data that we had transmitted to them verbally and visually through the television camera. I had hoped that I would have the benefit of their thinking, but apparently this was not possible.
I would like to think that in the future we can look at ways of using the team approach to science investigations in space rather than depending solely on the observational capability and the interpretative capability of the men who are performing the job. There is no reason that I can see not to use all the brain power that is available at any given task, and part of that brain power is on the ground.
27. Human Factors

27.1 Preflight

Cernan|Preflight health stabilization and control program - I guess it was adequate. We stayed healthy; we came back healthy. Medical care was adequate. Preflight time for rest, exercise, and sleep is something that only the crew can provide for because there's never enough time to train. Whim there's not enough time to train, then there's never enough time to get adequate sleep, rest, and exercise. It requires a certain amount of scheduling and crew discipline to get it all in. I believe that we got it in. Adequately prepared physiologically for the flight at lift- off.
Medical briefing and exams - After extensive preflight work for several months prior to the exams, I think that they eventually ran relatively smooth with the exception of a few misconceptions over the use of the lower body negative pressure in the CMP's G-suit garment, which eventually got resolved.
Eating habits and amount of food consumption. Preflight - I think the crew has no gripes. We were satisfied.
Evans|It was good.
Cernan|The medical department was satisfied and we were satisfied.
Schmitt|I personally did not find any great difficulty working out or adhering to the requirements. Medical care, although a very limited requirement, was good. I had a couple of sinus infections that reacted as they always had, and we were able over a period of 10 days or two weeks to get those cleared up.
Time for exercise was probably less than it should have been, although I was able to get a good workout about every other day in addition to the workouts we got as a normal course of our EVA training. Eventually Tex started scheduling a pretty normal schedule time in the late afternoon for exercise. That helped as a reminder to see that that exercise was obtained. It is hard, at least in the lunar training program, to get in exercise periods during the day. Quite frequently, the exercise was done in the KSC gym at night. Rest and sleep is an individual thing. I made a particular effort to always get as much as I possibly could and never get behind the power curve on rest. My personal experience is that I tend to get colds and resulting sinus infections.
Medical briefing was good. The exams seemed to go very well in my estimation. They were as expeditious as possible under the circumstances. I think the operational medical personnel who carried out the exams are to be complimented in their efforts to see that the exam was as painless and as efficient as possible. This should also include the postflight exams on the Ticonderoga.
Eating habits and the amount of food consumption were normal except during those periods when we were on the inflight food prior to launch. Those times tended to decrease my appetite, although the food was certainly tolerable. It was not possible for me to eat the amount of food that was provided for me. This also applied to space work in the case of the inflight eating. Although I did not eat everything that was available in my food packages, I apparently needed to if I wanted to avoid losing weight. My appetite was down and I had a loss of weight. At the time of this recording, my weight has not yet gone up to preflight levels, which may have been a little high.
27.2 Flight

Cernan|Appetite and food preference.
Evans|Appetite in-flight versus 2-week preflight - I don't think there was any change for me after the first day and a half.
Cernan|My appetite normally inflight, based upon past experience, will decrease markedly versus nominal preflight activity. Everything else being consistently nominal, I would probably have to force myself to eat because the requirement is there to have that energy and food, but the appetite would not necessarily be there. This is just typical of me. In this particular case, the food, as expected, produced a great deal of gas. For the first part of the flight, it was unpassable gas which resulted in a big football-like knot in the stomach which ranged in degree from inconvenience to annoyance to disturbing and downright painful in some cases. That also degraded the appetite because every time I ate it just stimulated this particular problem.
Difference notable in food tastes inflight versus preflight - I think the greatest difference is that there is always some gas in the water. One of the biggest problems in preflight is that you always have someone like Rita Rapp to prepare them and the inconvenience part of the job is done.
Evans|I didn't notice any real difference in food taste in flight versus preflight. To me, the wet packs taste like canned food, and the rehydratables had a better taste.
Cernan|It is obviously a very individualistic thing.
Evans|That's right; it's an individual thing, and I don't think it makes any difference whether from the first day on.
Cernan|Your food preference changes as to how you feel that day. If you see a package of shrimp cocktail that doesn't look very good, you don't rehydrate it; you don't want to eat it. And, as far as I'm concerned, I could eat 10 wetpacks to every rehydratable pack.
Evans|The first days when I really didn't feel like eating, I really didn't want the wetpacks. I would rather rehydrate something, because, to me, it had a better taste, because it didn't smell I guess. The smell of the wetpacks, when I really wasn't hungry, and still acclimating to zero-g flight on the first, day there, didn't appeal to me at all.
Cernan|I'm going to say again that the size of food portions and meal portions is a subjective individual thing. As far as I'm concerned, the food portions are entirely too great. The entire meal portions were too great and too large. I lost my 9 pounds. I predicted I'd lose somewhere between 8 and 10 pounds, and I just don't feel like I can eat as much food as there was to eat on that flight. Even though I ate more and more as the flight progressed, I very seldom consumed the entire meal that was presented at any given time.
Evans|In my case, I think, most generally, I ate just about everything. However, if you didn't have time, which, in my case, it seemed to Ire like there were times when I really didn't have time - once you get all that stuff ready and it gets on through there, you really don't have time to eat everything. So you, hopefully, try to get everything made and have time to go ahead and finish everything except maybe one package.
Cernan|Food preparation and consumption - Programs with rehydration (mixing and gases) - There is gas in all the water, and there appears to be a little more in the hot than in the cold. We added more water than was called for to make up for the amount of gas in the food. When I ate the food or drank the beverages with gas in it , I could expel it through my teeth, and not drink the gas, and still get the liquids out of the rehydratables. I don't really feel I drank or ate much gas out of the water, by comparison to what I could if I just swallowed everything that was in the package.
Evans|In try case, I swallowed everything. I never consciously tried to separate the bubbles and the water. I guess if you got an obvious bubble on the thing, you normally don't swallow bubbles; at least, I don't think I did. In the spoon-bowl packages, if you had a bubble in there, when you opened it up the bubble was gone, so there's no problem with the spoon-bowl packages. In spoon-bowl packages, the bubbles all developed in one big bubble, and you could break that one and have no problem at all with the gas in it. The hot water had more gas bubbles than the drink gun. Maybe they were smaller bubbles; let's put it that way.
Cernan|Food temperature - There's no question that the hot water, and it was always hot, was an excellent way of preparing the rehydratables that are desirable hot. In the LM, you did not have the privilege of hot water, and the difference in eating LM food with cold water, after eating some of that nice hot-water food in the command module, was very evident. There are some of those wetpacks (hamburgers, beef steaks, what have you) that, some way of heating them up, an oven or some other way, would increase the palatability of the food immensely.
Evans|Let me second that statement, for sure.
Cernan|Effect of water flavor and gas content on food - I don't think the flavor was any different than what we've seen in the past. The rehydratables are very closely attuned to the taste and flavor of regular table food, but they're never quite the same.
Use of spoon-bowl packs. We used those quite frequently, and I thought, for the most part, they worked out very well. We did something different with the soups or the more liquid spoon-bowl packs. Instead of actually opening them up and eating soup with a spoon, we just cut off the end from which you rehydrate them and suck them out. The lumpy foods, like the potatoes, we of course ate with a spoon.
