|2012|Chromite symplectites in Mg-suite troctolite 76535 as evidence for infiltration metasomatism of a lunar layered intrusion|Elardo, S. M., McCubbin, F. M., and Shearer, C. K.|Geochimica et Cosmochimica Acta|87||154-177 ||nan
|2012|The origin of chromite symplectites in lunar troctolite 76535: A new look at an old rock (abs)|Elardo, S. M., McCubbin, F. M., and Shearer, C. K.|Proceedings of the 43rd Lunar and Planetary Science Conference, |nan||nan||nan
|2012|Redetermination of the Sm-Nd age and initial Nd of Lunar troctolite 76535: Implications for the Lunar Crust development (abs)|Nyquist, L. E., Shih, C.-Y., and Reese, Y. D.|Proceedings of the 43rd Lunar and Planetary Science Conference, |nan||nan||nan
|2006|Cooling history of lunar Mg-suite gabbronorite 76255, troctolite 76535 and Stillwater pyroxenite SC-936: The record in exsolution and ordering in pyroxenes|McCallum, I. S., Domeneghetti, M. C., Schwartz, J. M., Mullen, E. K., Zema, M., Camara, F., McCammon, C., and Ganguly, J.|Geochimica et Cosmochimica Acta|70 (24)||6068-6078||http://dx.doi.org/10.1016/j.gca.2006.06.262
|2001|Complex cooling histories of lunar troctolite 76535 and Stillwater orthopyroxenite SC-936 (abs#1151)|Domeneghetti, M. C., McCallum, I. S., Schwartz, J. M., Camara, F., Zema, M., McCammon, C., and Ganguly, J.|Proceedings of the 30th Lunar and Planetary Science Conference, |nan||nan||nan
|1999|Inferred depths of formation of spinel cataclasites and troctolitic granulite, 76535 using new thermodynamic data for Cr-spinel (abs #1308)|Schwartz, J. M. and McCallum, I. S.|Proceedings of the 30th Lunar and Planetary Science Conference, |nan||nan||nan
|1993|North Massif lithologies and chemical compositions viewed from 2-4 mm particles of soil sample 76503 (abs)|Bishop, K. M., Jolliff, B. L., Korotev, R. L., and Haskin, L. A.|Proceedings of the Workshop on Geology of the Apollo 17 Landing Site|nan||2-3 ||nan
|1993|The ancient lunar crust, Apollo 17 region (abs)|James, O. B.|Proceedings of the Workshop on Geology of the Apollo 17 Landing Site|nan||17-18 ||nan
|1993|Possible petrogenetic associations among igneous components in North Massif Soils: Evidence in 2-4 mm soil particles from 76503|Jolliff, B. L., Bishop, K. M., and Haskin, L. A.|Proceedings of the Workshop on Geology of the Apollo 17 Landing Site|nan||92-09 ||nan
|1993|U-Pb isotopic ages and characteristics of ancient (>4.0 Ga) lunar highland rocks (abs)|Premo, W. R.|Proceedings of the 24th Lunar and Planetary Science Conference|nan||1169-1170 ||nan
|1993|Isotopic ages and characteristics of ancient (pre-Serenitatis) crustal rocks at Apollo 17|Premo, W. R. and Tatsumoto, M.|Proceedings of the Workshop on Geology of the Apollo 17 Landing Site|nan||45-48 ||nan
|1993|The Apollo 17 samples: The massifs and landslide|Ryder, G.|Proceedings of the Workshop on Geology of the Apollo 17 Landing Site|nan||48-49 ||nan
|1993|A concise compilation of petrologic information on possibly pristine nonmare Moon rocks|Warren, P. H.|American Mineralogist|nan||360-376 ||nan
|1992|The isotopic record of lunar volcanism|Nyquist, L. E. and Shih, C.-Y.|Geochimica et Cosmochimica Acta|56 (6)||2213-2234||http://dx.doi.org/10.1016/0016-7037(92)90185-l
|1992|Acid leaching of apatite: Implications for U-Th-Pb systematics of lunar highland plutonic rocks (abs)|Premo, W. R. and Tatsumoto, M.|Proceedings of the 23rd Lunar and Planetary Science Conference|nan||1101-1102 ||nan
|1992|U-Pb isotopes in dunite 72415 (abs)|Premo, W. R. and Tatsumoto, M.|Proceedings of the 23rd Lunar and Planetary Science Conference|nan||1103-1104 ||nan
|1992|U-Th-Pb, Rb-Sr, and Sm-Nd isotopic systematics of lunar troctolite cumulate 76535: Implications on the age and origin of this early lunar, deep-seated cumulate|Premo, W. R. and Tatsumoto, M.|Proceedings of the 22nd Lunar and Planetary Science Conference|nan||381-397 ||nan
|1992|Chemical variation and zoning of olivine in lunar dunite 72415: Near-surface accumulation|Ryder, G.|Proceedings of the 22nd Lunar and Planetary Science Conference|nan||373-380 ||nan
|1991|Mineral compositions in pristine lunar highland rocks and the diversity of highland magmatism|Bersch, M. G., Taylor, G. J., Keil, K., and Norman, M. D.|Geophysical Research Letters|18 (11)||2085-2088||http://dx.doi.org/10.1029/91GL02540
|1991|Pb isotopes in troctolite 76535 (abs)|Premo, W. R. and Tatsumoto, M.|Proceedings of the 22nd Lunar and Planetary Science Conference|nan||1093-1094 ||nan
|1989|REE and selected minor and trace element microdistributions in some pristine lunar highlands rocks (abs)|Heavilon, C. F. and Crozaz, G.|Proceedings of the 20th Lunar and Planetary Science Conference|nan||398-399 ||nan
|1989|Ages of pristine lunar plutonic rocks and their petrogenetic implications (abs)|Shih, C.-Y., Nyquist, L. E., Dasch, E. J., Bansal, B. M., and Wiesmann, H.|Proceedings of the 20th Lunar and Planetary Science Conference|nan||1004-1005 ||nan
|1988|Normal and anomalous compositions of lunar feldspars- I. Lunar plagioclases (abs)|Miura, Y.|Proceedings of the 19th Lunar and Planetary Science Conference|nan||794-795 ||nan
|1987|Pristine moon rocks: A "large" felsite and a metal-rich ferroan anorthosite|Warren, P. H., Jerde, E. A., and Kallemeyn, G. W.|Journal of Geophysical Research|90 (B4)||E303-E313||http://dx.doi.org/10.1029/JB092iB04p0E303
|1986|Crystal structure refinement of a lunar anorthite, An94|Smyth, J. R.|Journal of Geophysical Research|91||E91-97 ||nan
|1984|Olivine in lunar dunite 72415, a rather shallow-origin cumulate (abs)|Ryder, G.|Proceedings of the 15th Lunar and Planetary Science Conference|nan||709-710 ||nan
|1983|Subdivision of the Mg-suite noritic rocks into Mg-gabbronorites and Mg-norites|James, O. B. and Flohr, M. K.|Proceedings of the 13th Lunar and Planetary Science Conference|nan||A603-A614 ||nan
|1983|Nickel in olivines and parent magmas of lunar pristine rocks|Ryder, G.|Proceedings of the Workshop on Pristine Highlands Rocks and the Early History of the Moon|nan||66-68 ||nan
|1982|Subdivision of the Mg-suite plutonic rocks into Mg-norites and Mg-gabbronorites (abs)|James, O. B.|Proceedings of the 13th Lunar and Planetary Science Conference|nan||360-362 ||nan
|1982|Pu-Nd-Xe dating: Progress towards a solar system Pu/Nd ratio (abs)|Jost, D. T. and Marti, K.|Proceedings of the 13th Lunar and Planetary Science Conference|nan||371-372 ||nan
|1981|Troctolite 76535: A study in the preservation of early isotopic records|Caffee, M. W., Hohenberg, C. M., and Hudson, B.|Proceedings of the 12th Lunar and Planetary Science Conference|nan||99-115 ||nan
|1981|Olivine barometry: Application to pressure estimation for terrestrial and lunar rocks (abs)|Finnerty, A. A. and Rigden, S. M.|Proceedings of the 12th Lunar and Planetary Science Conference|nan||279-281 ||nan
|1980|Constraints on the chemical nature of magmas parental to pristine highland cumulates (abs)|Delano, J. W.|Proceedings of the 11th Lunar and Planetary Science Conference|nan||216-218 ||nan
|1980|Minor elements in lunar olivine: Electron probe analyses of Na, Al, P, Ca, Ti, Cr, Mn, and Ni (abs)|Hansen, E. C., Smith, J. V., and Steele, I. M.|Proceedings of the 11th Lunar and Planetary Science Conference|nan||391-393 ||nan
|1980|Fission xenon in troctolite 76535|Hohenberg, C. M., Hudson, B., Kennedy, B. M., and Podosek, F. A.|Geochimica et Cosmochimica Acta|Suppl. 12 ||419-439 ||nan
|1980|Candidate samples for the earliest lunar crust|Jovanovic, S. and Reed, G. W.|Geochimica et Cosmochimica Acta|Suppl. 12 ||101-111 ||nan
|1980|The distinction of pristine from meteorite-contaminated highlands rocks using metal compositions|Ryder, G., Norman, M. D., and Score, R. A.|Proceedings of the 11th Lunar and Planetary Science Conference|nan||471-479 ||nan
|1980|Lunar highland rocks: Element partitioning among minerals II: Electron microprobe analyses of Al, P, Ca, Ti, Cr, Mn and Fe in olivine|Smith, J. V., Hansen, E. C., and Steele, I. M.|Proceedings of the 11th Lunar and Planetary Science Conference|nan||555-569 ||nan
|1980|Ion-probe determination of Li, Na, Mg, Ti, Sr and Ba in lunar plagioclase (abs)|Steele, I. M. and Smith, J. V.|Proceedings of the 11th Lunar and Planetary Science Conference|nan||1085-1087 ||nan
|1980|Ion microprobe analysis and petrogenetic interpretations of Li, Mg, Ti, K, Sr, Ba in lunar plagioclase|Steele, I. M., Hutcheon, I. D., and Smith, J. V.|Proceedings of the 11th Lunar and Planetary Science Conference|nan||571-590 ||nan
|1979|Lunar highland rocks: Element partitioning among minerals 1: Electron microprobe analyses of Na, K, and Fe in plagioclase; mg partitioning with orthopyroxene|Hansen, E. C., Steele, I. M., and Smith, J. V.|Proceedings of the 10th Lunar and Planetary Science Conference|nan||627-638 ||nan
|1979|Minor elements in plagioclase and mafic minerals from lunar plagioclase-rich rocks (abs)|Hansen, E. C., Steele, I. M., and Smith, J. V.|Proceedings of the 10th Lunar and Planetary Science Conference|nan||497-499 ||nan
|1979|Minor elements in plagioclase from lunar highland rocks: New data, especially for granulitic impactites|Hansen, E. C., Steele, I. M., and Smith, J. V.|Proceedings of the Conference on the Lunar Highlands Crust|nan||39-41 ||nan
|1979|Identification of pristine lunar highland rocks: Criteria based on mineral chemistry and stability (abs)|Herzberg, C. T.|Proceedings of the 10th Lunar and Planetary Science Conference|nan||537-539 ||nan
|1979|Catalog of pristine non-mare materials Part 1. Non-anorthosites. Revised|Ryder, G. and Norman, M. D.|nan|nan||nan||nan
|1979|Terrestrial and lunar impact breccias and the classification of lunar rocks|Stöffler, D., Knoll, H.-D., and Maerz, U.|Proceedings of the 10th Lunar and Planetary Science Conference|nan||639-675 ||nan
|1979|Lunar basalts and pristine highland rocks: Comparison of siderophile and volatile elements|Wolf, R., Woodrow, A., and Anders, E.|Proceedings of the 10th Lunar and Planetary Science Conference|nan||2107-2130 ||nan
|1978|Lunar initial 143Nd/144Nd: Differential evolution of the lunar crust and mantle|Lugmair, G. W. and Marti, K.|Earth and Planetary Science Letters|39 (3)||349-357||http://dx.doi.org/10.1016/0012-821x(78)90021-3
|1977|Spectral reflectance of lunar highland rocks (abs)|Charette, M. P. and Adams, J. B.|Proceedings of the 8th Lunar Science Conference|nan||172-174 ||nan
|1977|Lunar basins and craters: Evidence for systematic compositional changes of bombarding population|Hertogen, J., Janssens, M.-J., Takahashi, H., Palme, H., and Anders, E.|Proceedings of the 8th Lunar Science Conference|nan||17-45 ||nan
|1977|Structure, composition, and significance of G-P zones in 76535 orthopyroxene (abs)|Nord, G. L., Heubner, J. S., and Ross, M.|Proceedings of the 8th Lunar Science Conference|nan||732-734 ||nan
|1977|Mineralogy, petrology and chemistry of ANT-suite rocks from the lunar highlands|Prinz, M. and Keil, K.|Physics and Chemistry of the Earth|10||215-237 ||nan
|1976|Zr-Hf fractionation in chemically defined lunar rock groups|Garg, A. N. and Ehmann, W. N.|Proceedings of the 7th Lunar Science Conference|nan||3397-3410 ||nan
|1976|Microstratigraphy of the lunar regolith and compaction ages of lunar breccias|Goswami, J. N., Braddy, D., and Price, P. B.|Proceedings of the 7th Lunar Science Conference|nan||55-74 ||nan
|1976|Pyroxene geothermometry and crystallization, subsolidus equilibration temperatures of lunar and, achondritic pyroxenes (abs)|Ishii, T., Miyamoto, M., and Takeda, H.|Proceedings of the 7th Lunar Science Conference|nan||408-410 ||nan
|1976|Convection cells in the early lunar magma ocean: trace-element evidence|Jovanovic, S. and Reed, G. W.|Proceedings of the 7th Lunar Science Conference|nan||3447-3459 ||nan
|1976|The low Sm/Nd region of the Moon: Evolution and history of a troctolite and a KREEP basalt (abs)|Lugmair, G. W., Kurtz, J. P., Marti, K., and Scheinin, N. B.|Proceedings of the 7th Lunar Science Conference|nan||509-511 ||nan
|1976|History and genesis of lunar troctolite 76535 or: How old is old?|Lugmair, G. W., Marti, K., Kurtz, J. P., and Scheinin, N. B.|Proceedings of the 7th Lunar Science Conference|nan||2009-2203 ||nan
|1976|76535: Thermal history deduced from pyroxene precipitation in anorthite|Nord, G. L.|Proceedings of the 7th Lunar Science Conference|nan||1875-1888 ||nan
|1976|Lunar troctolite 76535: Mineralogical investigations (abs)|Nord, G. L., Ross, M., and Huebner, J. S.|Proceedings of the 7th Lunar Science Conference|nan||628-630 ||nan
|1976|Early lunar differentiates and lunar initial 86Sr/86Sr (abs)|Papanastassiou, D. A. and Wasserburg, G. J.|Proceedings of the 7th Lunar Science Conference|nan||665-667 ||nan
|1976|Rb-Sr age of troctolite 76535|Papanastassiou, D. A. and Wasserburg, G. J.|Proceedings of the 7th Lunar Science Conference|nan||2035-2054 ||nan
|1976|Mineralogy and petrology of complex breccia 14063|Steele, I. M. and Smith, J. V.|Proceedings of the 7th Lunar Science Conference|nan||1949-1964 ||nan
|1975|Spinel symplectites: High pressure solid-state reaction or late-stage magmatic crystallization? (abs)|Albee, A. L., Dymek, R. F., and DePaolo, D. J.|Proceedings of the 6th Lunar Science Conference|nan||1-3 ||nan
|1975|Cosmic ray exposure ages of features and events at the Apollo landing sites|Arvidson, R., Crozaz, G., Drozd, R. J., Hohenberg, C. M., and Morgan, C. J.|The Moon|13 (1)||259-276||http://dx.doi.org/10.1007/bf00567518
|1975|The problem of the origin of symplectites in olivine-beating lunar rocks|Bell, P. M., Mao, H. K., Roedder, E., and Weiblen, P. W.|Proceedings of the 6th Lunar Science Conference|nan||231-248 ||nan
|1975|76535: An old lunar rock|Bogard, D. D., Nyquist, L. E., Bansal, B. M., Wiesmann, H., and Shih, C.-Y.|Earth and Planetary Science Letters|26 (1)||69-80||http://dx.doi.org/10.1016/0012-821X(75)90178-8
|1975|Crystal chemistry of Pu and U and concordant fission track ages of lunar zircons and whitlockites|Braddy, D., Hutcheon, I. D., and Price, P. B.|Proceedings of the 6th Lunar Science Conference|nan||3581-3600 ||nan
|1975|Comparative petrology of lunar cumulate rocks of possible primary origin: Dunite 72415, troctolite 76535, norite 78235, and anorthosite 62237|Dymek, R. F., Albee, A. L., and Chodos, A. A.|Proceedings of the 6th Lunar Science Conference|nan||301-341 ||nan
|1975|Comparison of silicate and metal geothermometers for lunar rocks (abs)|Goldstein, J. I. and Hewins, R. H.|Proceedings of the 6th Lunar Science Conference|nan||356-358 ||nan
|1975|Geochemistry of opaque oxides in troctolites and basalts from Taurus Littrow (abs)|Haggerty, S. E.|Proceedings of the 6th Lunar Science Conference|nan||321-323 ||nan
|1975|The provenance of metal in anorthositic rocks|Hewins, R. H. and Goldstein, J. I.|Proceedings of the 6th Lunar Science Conference|nan||343-362 ||nan
|1975|Lead-lead and trace element abundances in lunar troctolite, 76535 (abs)|Hinthorne, J. R., Conrad, R. L., and Andersen, C. A.|Proceedings of the 6th Lunar Science Conference|nan||373-375 ||nan
|1975|Trapped 40Ar in troctolite 76535 and evidence for enhanced 40Ar-39Ar age plateaus (abs)|Huneke, J. C. and Wasserburg, G. J.|Proceedings of the 6th Lunar Science Conference|nan||417-419 ||nan
|1975|Lunar evolution: The first 600 million years|Husain, L. and Schaeffer, O. A.|Geophysical Research Letters|2||29-32 ||nan
|1975|Some correlation of rock exposure ages and regolith dynamics|Hörz, F., Gibbons, R. V., Gault, D. E., Hartung, J. B., and Brownlee, D. E.|Proceedings of the 6th Lunar Science Conference|nan||3495-3508 ||nan
|1975|Cl and P205 systematics: Clues to early lunar magmas|Jovanovic, S. and Reed, G. W.|Proceedings of the 6th Lunar Science Conference|nan||1737-1751 ||nan
|1975|Intracrystalline cation order in a lunar crustal troctolite|Smyth, J. R.|Proceedings of the 6th Lunar Science Conference|nan||821-832 ||nan
|1975|A compilation of the Lunar Sample Data Generated by the Gast, Nyquist and Hubbard Lunar Sample PI-Ships|Wiesmann, H. and Hubbard, N. J.|nan|nan||nan||nan
|1974|Mineral-chemical properties of Apollo 17 mare basalts and terra fragments (abs)|Brown, G. M., Peckett, A., Emeleus, C. H., and Phillips, R.|Proceedings of the 5th Lunar Science Conference|nan||89-91 ||nan
|1974|Lunar surface dynamics: Some general conclusions and new results from Apollo 16 and 17|Crozaz, G., Drozd, R. J., Hohenberg, C., Morgan, C., Ralston, C., Walker, R., and Yuhas, D.|Proceedings of the 5th Lunar Science Conference|nan||2475-2499 ||nan
|1974|Plagioclase twin laws in lunar highland rocks; possible petrogenetic significance|Dowty, E., Keil, K., and Prinz, M.|Meteoritics|9||183-197||http://dx.doi.org/10.1111/j.1945-5100.1974.tb00074.x
|1974|A lunar rock of deep crustal origin: Sample 76535|Gooley, R. C., Brett, R., Warner, J. L., and Smyth, J. R.|Geochimica et Cosmochimica Acta|38||1329-1339 ||nan
|1974|Chemical evidence for the origin of 76535 as a cumulate|Haskin, L. A., Shih, C.-Y., Bansal, B. M., Rhodes, J. M., Wiesmann, H., and Nyquist, L. E.|Proceedings of the 5th Lunar Science Conference|nan||1213-1225 ||nan
|1974|Labile and nonlabile element relationships among Apollo 17 samples|Jovanovic, S. and Reed, G. W.|Proceedings of the 5th Lunar Science Conference|nan||1685-1701 ||nan
|1974|Labile trace elements in Apollo 17 samples (abs)|Jovanovic, S. and Reed, G. W.|Proceedings of the 5th Lunar Science Conference|nan||391-393 ||nan
|1974|Determination of natural and cosmic ray induced radionuclides in Apollo 17 lunar samples|Keith, J. E., Clark, R. S., and Bennett, L. J.|Proceedings of the 5th Lunar Science Conference|nan||2121-2138 ||nan
|1974|Ion microprobe mass analysis of plagioclase from “non-mare” lunar samples|Meyer, C., Anderson, D. H., and Bradley, J. G.|Proceedings of the 5th Lunar Science Conference|nan||685-706 ||nan
|1974|Lunar basins: Tentative characterization of projectiles, from meteoritic dements in Apollo 17 boulders|Morgan, J. W., Ganapathy, R., Higuchi, H., Krahenbuhl, U., and Anders, E.|Proceedings of the 5th Lunar Science Conference|nan||1703-1736 ||nan
|1974|Description, Classification and Inventory of Apollo 17 Rake Samples from Station 6|Phinney, W. C., Simonds, C. H., and Warner, J.|nan|nan||nan||nan
|1974|The relationships between geology and soil chemistry at the Apollo 17 landing site|Rhodes, J. M., Rodgers, K. V., Shih, C.-Y., Bansal, B. M., Nyquist, L. E., Wiesmann, H., and Hubbard, N. J.|Proceedings of the 5th Lunar Science Conference|2||1097-1117 ||nan
|1974|Petrography and classification of Apollo 17 non-mare rocks with emphasis on samples from the Station 6 boulder|Simonds, C. H., Phinney, W. C., and Warner, J. L.|Proceedings of the 5th Lunar Science Conference|nan||337-353 ||nan
|1974|The lunar time scale and a summary of isotopic evidence for a terminal lunar cataclysm (abs)|Tera, F., Papanastassiou, D. A., and Wasserburg, G. J.|Proceedings of the 5th Lunar Science Conference|nan||792-794 ||nan
|1974|U-Th-Pb systematic on lunar rocks and inferences about lunar evolution and the age of the moon|Tera, F., Papanastassiou, D. A., and Wasserburg, G. J.|Proceedings of the 5th Lunar Science Conference|nan||1571-1599 ||nan
|1973|Apollo 17 lunar samples: Chemical and petrographic description|Lunar Sample Preliminary Examination Team|Science|182||659-690 ||nan
