|1990|Resolution of ages and Sm-Nd isotopic characteristics in Apollo 17 high-Ti basalts (abs)|Paces, J. B., Nakai, S., Neal, C. R., Taylor, L. A., Halliday, A. N., Lee, D.-C., and McKinney, M. C.|Proceedings of the 21st Lunar and Planetary Science Conference|nan||924-925 ||nan
|1983|A review of lunar paleointensity data and implications for the origin of lunar magnetism|Cisowski, S. M., Collinson, D. W., Runcom, S. K., Stephenson, A., and Fuller, M.|Proceedings of the 13th Lunar and Planetary Science Conference|nan||A691-A704 ||nan
|1981|Catalog of lunar mare basalts greater than 40 grams|Lofgren, G. E. and Lofgren, E. M.|nan|nan||nan||nan
|1979|A simplified model for glass formation|Uhlmann, D. R., Onorato, P. I. K., and Scherer, G. W.|Proceedings of the 10th Lunar and Planetary Science Conference|nan||375-381 ||nan
|1978|Trace element evidence for a laterally inhomogeneous Moon|Jovanovic, S. and Reed, G. W.|Proceedings of the 9th Lunar and Planetary Science Conference|nan||59-80 ||nan
|1978|Causes of compositional variations within mare basalt suites|Lindstrom, M. M. and Haskin, L. A.|Proceedings of the 9th Lunar and Planetary Science Conference|nan||465-486 ||nan
|1977|On the intensity of ancient lunar fields|Cisowski, S. M., Hale, C. J., and Fuller, M.|Proceedings of the 8th Lunar Science Conference|nan||725-750 ||nan
|1977|Further insights into the evolution of the early Moon: Convection cells, II. Ru-Os partitioning and mixing (abs)|Jovanovic, S., Jensen, K. J., and Reed, G. W.|Proceedings of the 8th Lunar Science Conference|nan||516-518 ||nan
|1977|Shock effects in some lunar basalts (abs)|Schaal, R. B. and Hörz, F.|Proceedings of the 8th Lunar Science Conference|nan||832-834 ||nan
|1977|Shock metamorphism of lunar and terrestrial basalts|Schaal, R. B. and Hörz, F.|Proceedings of the 8th Lunar Science Conference|nan||1697-1729 ||nan
|1976|Nature of the sulfur in the Apollo 17 basalts and their source regions (abs)|Gibson, E. K., Morris, R. V., and Usselman, T. M.|Proceedings of the 7th Lunar Science Conference|nan||290-292 ||nan
|1976|Nitrogen in lunar igneous rocks|Müller, O., Grallath, E., and Tolg, G.|Proceedings of the 7th Lunar Science Conference|nan||1615-1622 ||nan
|1976|Chemistry, classification, and petrogenesis of Apollo 17 mare basalts|Rhodes, J. M., Hubbard, N. J., Wiesmann, H., Rodgers, K. V., Brannon, J. C., and Bansal, B. M.|Proceedings of the 7th Lunar Science Conference|nan||1467-1489 ||nan
|1975|Mixing and transport of lunar surface materials: Evidence obtained by the determination of lithophile, siderophile, and volatile elements|Boynton, W. V., Baedecker, P. A., Chou, C.-L., Robinson, K. L., and Wasson, J. T.|Proceedings of the 6th Lunar Science Conference|nan||2241-2259 ||nan
|1975|Surface correlation of volatile elements in Apollo-16 soils (abs)|Boynton, W. V., Chou, C.-L., Bild, R. W., and Wasson, J. T.|Proceedings of the 6th Lunar Science Conference|nan||74-76 ||nan
|1975|Petrology and mineralogy of Apollo 17 mare basalts|Brown, G. M., Peckett, A., Emeleus, C. H., Phillips, R., and Pinsent, R. H.|Proceedings of the 6th Lunar Science Conference|nan||1-13 ||nan
|1975|Mineralogy and petrology of Apollo 17 basalts (abs)|Brown, G. M., Peckett, A., Phillips, R., and Emeleus, C. H.|Proceedings of the 6th Lunar Science Conference|nan||95-97 ||nan
|1975|Genetic relations between the moon and meteorites|Clayton, R. N. and Mayeda, T. K.|Proceedings of the 6th Lunar Science Conference|nan||1761-1769 ||nan
|1975|Viscous flow, crystallization behaviour, and thermal histories of lunar breccias 70019 and 79155|Klein, L., Onorato, P. I. K., Uhlmann, D. R., and Hopper, R. W.|Proceedings of the 6th Lunar Science Conference|nan||579-593 ||nan
|1975|Oxygen isotope fractionation of Apollo 17 rocks|Mayeda, T. K., Shearer, J., and Clayton, R. N.|Proceedings of the 6th Lunar Science Conference|nan||1799-1802 ||nan
|1975|Rb-Sr ages and initial 86Sr/86Sr for Apollo 17 basalts and KREEP basalt 15386|Nyquist, L. E., Bansal, B. M., and Wiesmann, H.|Proceedings of the 6th Lunar Science Conference|nan||1445-1465 ||nan
|1975|Anomalous low-K silicate melt inclusions in ilmenite from Apollo 17 basalts|Roedder, E. and Weiblen, P. W.|Proceedings of the 6th Lunar Science Conference|nan||147-164 ||nan
|1975|Chemical composition of rocks and soils returned by the Apollo 15, 16, and 17 missions|Rose, H. J., Baedecker, P. A., Berman, S., Christian, R. P., Dwornik, E. J., Finkelman, R. B., and Schnepfe, M. M.|Proceedings of the 6th Lunar Science Conference|nan||1363-1373 ||nan
|1975|Major elemental analysis of some Apollo 15, 16, and 17 samples (abs)|Rose, H. J., Christian, R. P., Dwornik, E. J., and Schnepfe, M. M.|Proceedings of the 6th Lunar Science Conference|nan||686-688 ||nan
|1975|On the origin of high-Ti mare basalts|Shih, C.-Y., Haskin, L. A., Wiesmann, H., Bansal, B. M., and Brannon, J. C.|Proceedings of the 6th Lunar Science Conference|nan||1255-1285 ||nan
|1975|A compilation of the Lunar Sample Data Generated by the Gast, Nyquist and Hubbard Lunar Sample PI-Ships|Wiesmann, H. and Hubbard, N. J.|nan|nan||nan||nan
|1975|New data on the chemistry of lunar samples: Primary matter in the lunar highlands and the bulk composition of the moon|Wänke, H., Palme, C., Baddenhausen, H., Dreibus, G., Jagoutz, E., Kruse, H., Palme, C., Spettel, B., Teschke, F., and Thacker, R.|Proceedings of the 6th Lunar Science Conference|nan||1313-1340 ||nan
|1975|New data on the chemistry of lunar samples and about the major element composition of KREEP (abs)|Wänke, H., Palme, H., Baddenhausen, H., Dreibus, G., Jagoutz, E., Kruse, H., Spettel, B., Teschke, F., and Thacker, R.|Proceedings of the 6th Lunar Science Conference|nan||844-846 ||nan
|1974|Volatile and siderophile trace elements in the soils and rocks of Taurus-Littrow|Baedecker, P. A., Chou, C.-L., Sundberg, L. L., and Wasson, J. T.|Proceedings of the 5th Lunar Science Conference|nan||1625-1643 ||nan
|1974|Loss of oxygen, silicon, sulfur, and potassium from the lunar regolith|Clayton, R. N., Mayeda, T. K., and Hurd, J. M.|Proceedings of the 5th Lunar Science Conference|nan||1801-1809 ||nan
|1974|Taurus-Littrow TiO2-rich basalts: Opaque mineralogy and geochemistry|El Goresy, A., Ramdohr, P., Medenbach, O., and Bernhardt, H.-J.|Proceedings of the 5th Lunar Science Conference|nan||627-652 ||nan
|1974|Primordial radioelement concentrations in rocks and soils from Taurus-Littrow|Eldridge, J. S., O'Kelley, G. D., and Northcutt, K. J.|Proceedings of the 5th Lunar Science Conference|nan||1025-1033 ||nan
|1974|Lunar microcrater studies, derived meteoroid fluxes, and comparison with satellite-borne experiments|Fechtig, H., Hartung, J. B., Nagel, K., Neukum, G., and Storzer, D.|Proceedings of the 5th Lunar Science Conference|nan||2463-2474 ||nan
|1974|Chronology of the Taurus-Littrow region III: ages of mare basalts and highland breccias and some remarks about the interpretation of lunar highland rock ages|Kirsten, T. and Horn, P.|Proceedings of the 5th Lunar Science Conference|nan||1451-1475 ||nan
|1974|Evidence of extensive chemical reduction in lunar regolith samples from the Apollo 17 site|Mao, H. K., El Goresy, A., and Bell, P. M.|Proceedings of the 5th Lunar Science Conference|nan||673-683 ||nan
|1974|Orange glasses: Reaction of molten liquids with Apollo 17 soil breccia-70019 and gabbro-79155 (abs)|Mao, H. K., El Goresy, A., and Bell, P. M.|Proceedings of the 5th Lunar Science Conference|nan||489-491 ||nan
|1974|Lunar basins: Tentative characterization of projectiles, from meteoritic dements in Apollo 17 boulders|Morgan, J. W., Ganapathy, R., Higuchi, H., Krahenbuhl, U., and Anders, E.|Proceedings of the 5th Lunar Science Conference|nan||1703-1736 ||nan
|1974|Solar wind nitrogen and indigenous nitrogen in Apollo 17 lunar samples|Müller, O.|Proceedings of the 5th Lunar Science Conference|nan||1907-1918 ||nan
|1974|U-Th-Pb systematics of some Apollo 17 lunar samples and implications for a lunar basin excavation chronology|Nunes, P. D., Tatsumoto, M., and Unruh, D. M.|Proceedings of the 5th Lunar Science Conference|2.0||1487-1514 ||nan
|1974|Cosmogenic radionuclides in samples from Taurus-Littrow: Effects of the solar flare of August 1972|O'Kelley, G. D., Eldridge, J. S., and Northcutt, K. J.|Proceedings of the 5th Lunar Science Conference|nan||2139-2147 ||nan
|1974|U-Th-Pb systematics of some Apollo 17 samples (abs)|Tatsumoto, M., Unruh, D. M., and Nunes, P. D.|Proceedings of the 5th Lunar Science Conference|nan||562-564 ||nan
|1974|22Na-26Al chronology of lunar surface processes|Yokoyama, Y., Reyss, J. L., and Guichard, F.|Proceedings of the 5th Lunar Science Conference|nan||2231-2247 ||nan
|1973|Preliminary examination of lunar samples from Apollo 17|Lunar Sample Preliminary Examination Team|Apollo 17 Preliminary Science Report|nan||7-1-7-46 ||nan
|1973|Solar flare induced radionuclides and primordial radioelement concentrations in Apollo 17 rocks and frees preliminary results (abs)|O'Kelley, G. D., Eldridge, J. S., and Northcutt, K. J.|Proceedings of the 4th Lunar Science Conference|nan||572-574 ||nan
