|1992|Magnetic beneficiation of high-Ti mare basalts: Petrographic analyses (abs)|Taylor, L. A., McKay, D. S., Patchen, A., Wentworth, S., Oder, R., and Jerde, E. A.|Proceedings of the 23rd Lunar and Planetary Science Conference|nan||1415-1416 ||nan
|1990|Ilmenite in high-Ti Apollo 17 basalts: Variations in composition with degree of exsolution (abs)|Muhich, T., Vaniman, D. T., and Heiken, G.|Proceedings of the 21st Lunar and Planetary Science Conference|nan||817-819 ||nan
|1990|Resolution of ages and Sm-Nd isotopic characteristics in Apollo 17 high-Ti basalts (abs)|Paces, J. B., Nakai, S., Neal, C. R., Taylor, L. A., Halliday, A. N., Lee, D.-C., and McKinney, M. C.|Proceedings of the 21st Lunar and Planetary Science Conference|nan||924-925 ||nan
|1989|Germanium abundances in lunar basalts: Evidence of mantle metasomatism|Dickinson, T., Taylor, G. J., Keil, K., and Bild, R. W.|Proceedings of the 19th Lunar and Planetary Science Conference|nan||189-198 ||nan
|1988|Late-stage enrichment of Ge in the magma ocean: Evidence from lunar basalts (abs)|Dickinson, T., Bild, R. W., Taylor, G. J., and Keil, K.|Proceedings of the 19th Lunar and Planetary Science Conference|nan||277-278 ||nan
|1981|Catalog of lunar mare basalts greater than 40 grams|Lofgren, G. E. and Lofgren, E. M.|nan|nan||nan||nan
|1980|Candidate samples for the earliest lunar crust|Jovanovic, S. and Reed, G. W.|Geochimica et Cosmochimica Acta|Suppl. 12 ||101-111 ||nan
|1979|Lead isotope systematics of three Taurus-Littrow mare basalts (abs)|Chen, J. H., Tilton, G. R., and Mattinson, J. M.|Proceedings of the 10th Lunar and Planetary Science Conference|nan||195-197 ||nan
|1979|Lead isotope systematics of three Apollo 17 mare basalts|Tilton, G. R. and Chen, J. H.|Proceedings of the 10th Lunar and Planetary Science Conference|nan||259-274 ||nan
|1979|Ilmenite in the crystallization sequence of lunar rocks|von Engelhardt, W.|Proceedings of the 10th Lunar and Planetary Science Conference|nan||677-694 ||nan
|1978|Trace element evidence for a laterally inhomogeneous Moon|Jovanovic, S. and Reed, G. W.|Proceedings of the 9th Lunar and Planetary Science Conference|nan||59-80 ||nan
|1977|Trace element geochemistry and the early lunar differentiation|Jovanovic, S. and Reed, G. W.|Proceedings of the 8th Lunar Science Conference|nan||623-632 ||nan
|1977|Further insights into the evolution of the early Moon: Convection cells, II. Ru-Os partitioning and mixing (abs)|Jovanovic, S., Jensen, K. J., and Reed, G. W.|Proceedings of the 8th Lunar Science Conference|nan||516-518 ||nan
|1977|Composition of eight Apollo 17 basalts|Mason, B., Jarosowich, E., Jacobson, S., and Thompson, G.|Lunar Sample Studies|nan||41||nan
|1976|Cosmic ray exposure ages of Apollo 17 samples and the age of Tycho|Arvidson, R., Drozd, R. J., Guiness, E., Hohenberg, C., Morgan, C., Morrison, R., and Oberbeck, V.|Proceedings of the 7th Lunar Science Conference|nan||2817-2832 ||nan
|1976|Chemical fractionation in the lunar crust with emphasis on zirconium and hafnium (abs)|Garg, A. N. and Ehmann, W. N.|Proceedings of the 7th Lunar Science Conference|nan||281-283 ||nan
|1976|Zr-Hf fractionation in chemically defined lunar rock groups|Garg, A. N. and Ehmann, W. N.|Proceedings of the 7th Lunar Science Conference|nan||3397-3410 ||nan
|1976|Total nitrogen contents of Apollo 15, 16 and 17 lunar rocks and breccias (abs)|Moore, C. B. and Lewis, C. F.|Proceedings of the 7th Lunar Science Conference|nan||571-573 ||nan
|1976|Rb-Sr ages and isotopic systematics of some Serenitatis mare basalts|Murthy, V. R. and Coscio, C.|Proceedings of the 7th Lunar Science Conference|nan||1529-1544 ||nan
|1975|Mixing and transport of lunar surface materials: Evidence obtained by the determination of lithophile, siderophile, and volatile elements|Boynton, W. V., Baedecker, P. A., Chou, C.-L., Robinson, K. L., and Wasson, J. T.|Proceedings of the 6th Lunar Science Conference|nan||2241-2259 ||nan
|1975|Surface correlation of volatile elements in Apollo-16 soils (abs)|Boynton, W. V., Chou, C.-L., Bild, R. W., and Wasson, J. T.|Proceedings of the 6th Lunar Science Conference|nan||74-76 ||nan
|1975|Petrology and mineralogy of Apollo 17 mare basalts|Brown, G. M., Peckett, A., Emeleus, C. H., Phillips, R., and Pinsent, R. H.|Proceedings of the 6th Lunar Science Conference|nan||1-13 ||nan
|1975|Mineralogy and petrology of Apollo 17 basalts (abs)|Brown, G. M., Peckett, A., Phillips, R., and Emeleus, C. H.|Proceedings of the 6th Lunar Science Conference|nan||95-97 ||nan
|1975|Mare basalts: Characterization of compositional parameters by spectral reflectance|Charette, M. P. and Adams, J. B.|Proceedings of the Conference on Origins of Mare Basalts and Their Implications for Lunar Evolution|nan||25-28 ||nan
|1975|Comparative mineralogy and petrology of Apollo 17 mare basalts: Samples 70215, 71055, 74255, and 75055|Dymek, R. F., Albee, A. L., and Chodos, A. A.|Proceedings of the 6th Lunar Science Conference|nan||49-77 ||nan
|1975|Microcraters in oriented vugs- evidence for an anisotropy in the micrometeoroid flux (abs)|Hutcheon, I. D.|Proceedings of the 6th Lunar Science Conference|nan||420-422 ||nan
|1975|Micrometeorites and solar flare particles in and out of the ecliptic|Hutcheon, I. D.|Journal of Geophysical Research|80||4471-4483 ||nan
|1975|Oxygen isotope fractionation of Apollo 17 rocks|Mayeda, T. K., Shearer, J., and Clayton, R. N.|Proceedings of the 6th Lunar Science Conference|nan||1799-1802 ||nan
|1975|Total nitrogen contents of Apollo 15, 16 and 17 lunar fines samples|Moore, C. B. and Lewis, C. F.|Proceedings of the 6th Lunar Science Conference|nan||569-571 ||nan
|1975|Armalcolite crystallization, phenocryst assemblages, eruption conditions and origin of eleven high titanium basalts from Taurus Littrow (abs)|O'Hara, M. J. and Humphries, D. J.|Proceedings of the 6th Lunar Science Conference|nan||619-621 ||nan
|1975|Experimentally reproduced textures and mineral chemistries of high-titanium mare basalts|Usselman, T. M., Lofgren, G. E., Donaldson, C. H., and Williams, R. J.|Proceedings of the 6th Lunar Science Conference|nan||997-1020 ||nan
|1974|Volatile and siderophile trace elements in the soils and rocks of Taurus-Littrow|Baedecker, P. A., Chou, C.-L., Sundberg, L. L., and Wasson, J. T.|Proceedings of the 5th Lunar Science Conference|nan||1625-1643 ||nan
|1974|Inferences from comparative magnetic studies of some Apollo 17 basalts, breccias and soils (abs)|Brecher, A.|Proceedings of the 5th Lunar Science Conference|nan||83-85 ||nan
|1974|Mineral-chemical properties of Apollo 17 mare basalts and terra fragments (abs)|Brown, G. M., Peckett, A., Emeleus, C. H., and Phillips, R.|Proceedings of the 5th Lunar Science Conference|nan||89-91 ||nan
|1974|Elemental composition of Apollo 17 fines and rocks|Brunfelt, A. O., Heier, K. S., Nilssen, B., Steinnes, E., and Sundvoll, B.|Proceedings of the 5th Lunar Science Conference|nan||981-990 ||nan
|1974|Compositional studies of the lunar regolith at the Apollo 17 site|Miller, M. D., Pacer, R. A., Ma, M.-S., Hawke, B. R., Lookhart, G. L., and Ehmann, W. D.|Proceedings of the 5th Lunar Science Conference|nan||1079-1086 ||nan
|1974|Total carbon and sulfur contents of Apollo 17 lunar samples|Moore, C. B., Lewis, C. F., and Cripe, J. D.|Proceedings of the 5th Lunar Science Conference|nan||1897-1906 ||nan
|1974|Liquid-solid equilibria in lunar rocks from Apollo 15, 16 and 17, and phase relations in parts of the system CaMgSi2O6-CaFeSi2O6-Fe2SiO4-CaAl2Si2O8 (abs)|Muan, A., Lofall, T., and Ma, C.-B.|Proceedings of the 5th Lunar Science Conference|nan||529-530 ||nan
|1974|Origin of Apollo 17 rocks and soils|Philpotts, J. A., Schuhmann, S., Kouns, C. W., Lum, R. K. L., and Winzer, S. R.|Proceedings of the 5th Lunar Science Conference|nan||1255-1267 ||nan
|1974|Chemical composition of rocks and soils at Taurus-Littrow|Rose, H. J., Cuttitta, F., Berman, S., Brown, F. W., Carron, M. K., Christian, R. P., Dwornik, E. J., and Greenland, L. P.|Proceedings of the 5th Lunar Science Conference|nan||1119-1133 ||nan
|1974|Carbon compounds in Apollo 17 lunar samples: Indications of cometary contribution to breccia 78155? (abs)|Sill, G. T., Nagy, B., Nagy, L. A., Hamilton, P. B., McEwan, W. S., and Urey, H. C.|Proceedings of the 5th Lunar Science Conference|nan||704-705 ||nan
|1974|A search for trivalent titanium in Apollo 17 pyroxenes (abs)|Sung, C.-M., Abu-Eid, R. M., and Burns, R. G.|Proceedings of the 5th Lunar Science Conference|nan||758-760 ||nan
|1974|Ti3+/Ti4+ ratios in lunar pyroxenes: implications to depth of origin of mare basalt magma|Sung, C.-M., Abu-Eid, R. M., and Burns, R. G.|Proceedings of the 5th Lunar Science Conference|nan||717-726 ||nan
|1974|The lunar time scale and a summary of isotopic evidence for a terminal lunar cataclysm (abs)|Tera, F., Papanastassiou, D. A., and Wasserburg, G. J.|Proceedings of the 5th Lunar Science Conference|nan||792-794 ||nan
|1974|Rock elastic properties and near-surface structure of Taurus-Littrow|Trice, R., Warren, N., and Anderson, O. L.|Proceedings of the 5th Lunar Science Conference|nan||2903-2911 ||nan
|1974|Microscopic and thermomagnetic analysis of Apollo 17 breccia and basalt: feasibility of obtaining meaningful paleointensities of the lunar magnetic field (abs)|Watson, D. E., Larson, E. E., and Reynolds, R. L.|Proceedings of the 5th Lunar Science Conference|nan||827-829 ||nan
