|1979|Ilmenite in the crystallization sequence of lunar rocks|von Engelhardt, W.|Proceedings of the 10th Lunar and Planetary Science Conference|nan||677-694 ||nan
|1977|Petrology of breccias from Apollo 17 rake samples (abs)|Warner, R. D., Taylor, G. J., and Keil, K.|Proceedings of the 8th Lunar Science Conference|nan||987||nan
|1977|Petrology of crystalline matrix breccias from Apollo 17 rake samples|Warner, R. D., Taylor, G. J., and Keil, K.|Proceedings of the 8th Lunar Science Conference|nan||1987-2006 ||nan
|1976|Cosmic ray exposure ages of Apollo 17 samples and the age of Tycho|Arvidson, R., Drozd, R. J., Guiness, E., Hohenberg, C., Morgan, C., Morrison, R., and Oberbeck, V.|Proceedings of the 7th Lunar Science Conference|nan||2817-2832 ||nan
|1975|Chemical composition of Apollo 17 samples: Boulder breccias (2), rake breccias (8), and others|Laul, J. C. and Schmitt, R. A.|Proceedings of the 6th Lunar Science Conference|nan||489-491 ||nan
|1974|Description, classification and inventory of 113 Apollo 17 rake samples from stations 1A, 2, 7 and 8|Keil, K., Dowty, E., and Prinz, M.|nan|nan||nan||nan
