2015AGUFM.P33C2136M|2015|High Spatial Resolution <SUP>40</SUP>Ar/<SUP>39</SUP>Ar Geochronology of Impact Melt Breccias from Apollo 17 Boulders at Stations 2, 6, and 7|Mercer, C. M., Hodges, K. V., Jolliff, B. L., Van Soest, M. C., Wartho, J. A., Weirich, J. R.|AGU Fall Meeting Abstracts|||P33C|Several boulders located at the bases of the North and South Massifs were among the primary field targets of the Apollo 17 mission to the Taurus-Littrow Valley on the Moon [1]. Some boulders are polylithologic, including Boulder 1 at Station 2 and the boulders at Stations 6 and 7. These boulders were the subjects of consortium studies [2, 3] that included 40Ar/39Ar geochronology to determine the ages of distinct lithologies within each boulder [e.g., 4-6]. We report new 40Ar/39Ar data for the impact melt breccias 72255, 76315, 77075, and 77135 obtained using the UV laser ablation microprobe (UVLAMP) methods of [7]. For 72255, we obtained a preliminary isochron date ca. 3814 Ma from 22 melt analyses, which is younger than published plateau dates (e.g., 3951-3835 Ma [4, 8]). Fifteen melt analyses of 76315 yield a preliminary isochron date ca. 3850 Ma, younger than the 3900 ± 16 Ma date reported by [8]. Melt analyses of 77075 yield preliminary dates between ca. 3797-3584 Ma, possibly reflecting partial loss of 40Ar. In this case, the oldest date may provide a minimum age for the formation of melt in 77075. Finally, the UVLAMP dates for the 77135 melt range from 3810-3361 Ma and corresponding Ca/K ratios range from ca. 100-6. Electron microprobe analyses of small (ca. 10s of microns wide) pockets of K-rich materials show that both K-rich glass and K-feldspar are present. The UVLAMP dates for 77135 likely reflect spatially variable 40Ar loss, consistent with published step heating results [e.g., 6]. References: [1] Schmitt (1973) Science, 182, 681-690. [2] Ryder (1993). Catalog of Apollo 17 Rocks: Volume 1 - Stations 2 and 3 (South Massif). LPI. [3] Ryder (1993). Catalog of Apollo 17 Rocks: Volume 4 - North Massif. LPI. [4] Leich et al. (1975) The Moon, 14, 407-444. [5] Cadogan & Turner (1976). LPSC, 7, 2267-2285. [6] Stettler et al. (1978). LPSC, 9, 1113-1115. [7] Mercer et al. (2015) Sci. Adv., 1, e1400050. [8] Dalrymple & Ryder (1996). JGR, 101, 26069-26084.|
1978LPSC....9..877M|1978|The Apollo 17 Station 7 boulder: Summary of study by the International Consortium.|Minkin, J. A., Thompson, C. L., Chao, E. C. T.|Lunar and Planetary Science Conference Proceedings|1||877|A systematic interdisciplinary study of the Apollo 17 station 7 boulder, from the foot of the North Massif at Taurus-Littrow, is described. The astronauts observed four lithologies: a large white clast represented by 77215, cut by dark dikelets (77075) and enclosed in blue-gray breccia (77115); the assemblage of these three rock types is in turn surrounded by green-gray breccia (77135). The history of the station 7 boulder, as construed from the results of the consortium study, is presented.|
1977LPSC....8.2301N|1977|The history of the Apollo 17 Station 7 boulder.|Nakamura, N., Tatsumoto, M.|Lunar and Planetary Science Conference Proceedings|2||2301|Rb-Sr and Sm-Nd methods were used to determine the age of the dark dikelets 77075 cutting the 4.36 b.y. noritic breccia 77215 of the Station 7 boulder of Apollo 17. A regression line corresponding to an age of 4.07 plus or minus 0.09 b.y. is obtained with an Rb-87 decay constant of 1.41 x 10 to the -11th/yr and an initial Sr-87/Sr-86 ratio of approximately 0.69918. It is noted that the intrusion age of the dikelets provides the most reliable criterion for determining the age of the entire boulder, i.e., the boulder is not an extension of 77115, which formed more recently. Attention is given to a generalized lunar history during the first 600 m.y.|
1974E&PSL..23..413C|1974|Preliminary petrographic description and geologic implications of the Apollo 17 Station 7 boulder consortium samples|Chao, E. C. T., Minkin, Jean A., Thompson, Carolyn L.|Earth and Planetary Science Letters|23|3|413|Preliminary petrographic description and mineral composition of four hand samples (77135, 77115, 77075 and 77215) are presented. 77135, 77115, and 77075 all crystallized from fragment-laden melts; they are similar in textures but differ in grain size. 77135 and 77115 are pigeonite feldspathic basalts. On the basis of geologic and petrographic evidence, 77115 and 77075 are related; they formed, cooled, and consolidated before being engulfed in the vesicular 77135. The impact or igneous origin of the melts from which these rocks crystallized cannot be determined. 77215 is a shocked, strongly sheared and granulated microbreccia consisting of three major lithologies dominated by mineral clasts of orthopyroxene and calcic plagioclase. The orthopyroxene clasts contain coarse exsolved blebs of augite, suggesting a deep-seated origin. The major, minor, and trace element compositions of 77135, 77115, and 77075 are in general similar. They represent a major highland rock type, perhaps more important than anorthosites.|http://dx.doi.org/10.1016/0012-821X(74)90130-7
1974E&PSL..23..439W|1974|Major, minor and trace element abundances in samples from the Apollo 17 station 7 boulder: Implications for the origin of early lunar crustal rocks|Winzer, Stephen R., Nava, David F., Schuhmann, Shuford, Kouns, Charles W., Lum, R. K. L., Philpotts, John A.|Earth and Planetary Science Letters|23|3|439|Apollo 17 station 7 boulder consortia samples were analyzed for major and minor elements by a combined semimicro atomic absorption spectrophotometric and colorimetric procedure. Lithophile trace element abundances were determined by stable isotope dilution mass spectrometry. Three matrix types samples (77135, 77115, and 77075) were found to be KREEP-rich fragment-laden melts with analogues throughout the Apollo 17 landing site. Of the five clasts analyzed, at least one (77115,19, troctolite) is thought to be a cumulate; 77135, 77115, and 77075 are thought to have originated by impact fusion of material with similar composition. This original material may represent a partial melt of a parent material of the composition of an included, shocked norite breccia (77215).|http://dx.doi.org/10.1016/0012-821X(74)90133-2
1974E&PSL..23..429B|1974|The dissection and consortium allocation of Apollo 17 lunar rocks from the boulder at station 7|Butler, P., Dealing, T. E.|Earth and Planetary Science Letters|23|3|429|The Apollo 17 astronauts removed four rocks samples to represent each of the lithologies they recognized in the boulder at station 7: sample 77215 from an off-white meter-sized block; sample 77075 from one of the thin dikes that cross the off-white block; 77115 from the blue-gray rock adjacent to the off-white block and apparently continuous with thin dikes that cross the block; sample 77135 of the tan-gray or green-gray vesicular rock adjacent to the blue-gray (77115) rock. A consortium of investigators has been organized, under the leadership of E.C.T. Chao, to study the samples. Each sample shows a number of lithologic types in terms of clasts (or xenoliths) and matrices. A table shows how subsamples have been allocated for consortium study. Maps and photographs show the relations between subsample locations and lithologies for the two more dissected samples, 77115 and 77135.|http://dx.doi.org/10.1016/0012-821X(74)90131-9
