1403504||CDR|I'm really stretching to reach back up to get the valve because now the suits are even harder than they were when I first opened the valve.
1403734||CDR|This was one of the reasons that it was a good idea not to leave things lying around in the cabin. Once the pressure got down low enough - 0.1 or 0.2 psi - you could lean down and use the handle to open the hatch. Then the rest of the air rushed out and anything lying around just zapped out the hatch with it.
1403743||LMP|Anything that wasn't tied down flew out. I don't remember any of the dust going out; it was down below the floor so it was a little harder for it to flow out.
1403745||CDR|The floor we stood on wasn't the pressure hull of the spacecraft but, rather, was a fitted floor made up of panels with cracks between them The dust got down in there and it was impossible to clean it out.
1403833||CDR|It took the suit regulator a while to get itself down to 3.85 psi and, until then, you were working with an extra stiff suit and there wasn't much point in trying to get down on your knees to get out.
1403849||LMP|The actual meaning of 'Roger' is 'Understood', but it tends to be used as a substitute for 'Affirmative'; most of the pilots tended to use 'Roger' wrong and this was just me, trying to get it right.
1404133||LMP|There was probably some kind of humorous picture that the support crew had inserted into the checklist at this point. Heaven knows what it was. I don't know where those checklists went. But the support crew kept sticking things in there, particularly Bob Parker. At the end of every section we could count on finding 'This is the end and not the beginning', because Gene had come up with a slogan for our mission 'This is the beginning and not the end' and Bob turned it around every chance he had. The typical weird humor of the Caltech graduate.
1404154||LMP|It was a lot easier using two hands going down the ladder. It wouldn't have hurt if you fell; or, I don't think it would have except it might have damaged the PLSS.
1404213||CDR|This was probably a hook on the lanyard that I was hooking onto the ETB or that I was using to attach the lanyard to the ladder. We learned on Gemini IX that, with the pressurized gloves and the lack of dexterity, we needed big things that we could get a hold on, not little things that you had to open with your finger tips. We learned a lot in the early days about the kind of equipment you needed to work with in the pressurized suits.
1404508||LMP|Getting out the second day was actually more exciting for me than the first was because it looked like we were actually going to have a chance to do something useful (laughing) rather than just deploy the ALSEP. I don't think getting out was an 'adrenaline pumping' type of excitement because your checklist kept you organized and moving from one thing to another. I think the real adrenaline was Launch, Translunar Injection, Lunar Orbit Insertion, Powered Descent Initiation, Landing, Lift-off from the Moon, and Trans-Earth Injection. Although, again, it's amazing how training and procedures suppress those kinds of things because everybody has things they have to do; and so you have to keep doing them. If you got into an adrenaline high you'd increase the chance of missing a step. Training is a great suppressor of adrenaline. It's like being prepared to take an exam in college. The more prepared you are, the less exciting it is.
1404508||CDR|I don't know that the adrenaline wasn't pumping the first time we got out on the surface. The second time I was a little more calm and collected, but there was still the realization that I was back out on the surface and that the first time around wasn't just a figment of my imagination. I agree with Jack that where the heart really started pounding and beating wasn't when you were crawling down the ladder. It was things like the landing. It wasn't like you were crawling down the ladder into a pit full of rattlesnakes. You were crawling down the ladder to do something you were looking forward to, something you knew you were going to enjoy, something that, within reason, you had control over. It wasn't one of those heart-pounding things, but it was still a little unbelievable that I was really there. The first day was almost literally like walking in a dream the whole time; the second day, you could look around and begin to appreciate a little more where you were and prepare to be a little more productive. Everything on the first EVA had been checkout, checkout, checkout, checkout. This time we had the Lunar Rover out, we had the ALSEP deployed, and we could begin enjoying ourselves.
1404702||CDR|Getting those antennas free was no easy task in the gloves.
1404859||LMP|Bob Parker and I had talked about getting a TV picture of a pendulum motion in one-sixth gravity. The lanyard was hanging down and so I just gave it a little push so that he could have his pendulum.
1405007||LMP|By putting the valve all the way up to full cold, you could very quickly feel a pulse of cold water in the Liquid Cooled Garment. This was done just to make sure the valve was working.
1405357||LMP|The LCRU batteries were stored in the MESA section of the descent stage, and we had to put in new ones for every EVA.
1405643||CDR|In listening to this part, I can still feel the frustration of trying to get that damn little LCRU battery out of a storage area in the MESA. The problems you want to deal with are the ones that are worth solving, not something little that's avoidable. Of course, the real world is always a little different than the training. The training is good because you can try to look at every possible aspect of what you're going to be doing. You anticipate problems, you get proficient, and you get productive; but you're always going to run into new and different situations and, when you do, it's the little, avoidable things that are frustrating. Like having to tie a shoelace that comes undone all the time. If you have the right shoelace to start with, you wouldn't have the problem. Same thing with these LCRU batteries: we had just started the damn EVA and all of a sudden I had to wrestle with a little battery that I should have been able to just pick up and put in place.
1405851||LMP|My shadow was the only long ruler that I regularly carried around with me. And, knowing that everybody underestimates distance on the Moon, I asked them to be ready to give me my shadow length so that I could see what it looked like and know what it really was. And it always looked a lot less long than it really was.
1410227||LMP|The first Apollo TV camera was just ludicrous. NASA just totally screwed up the specs in buying the thing and there was no excuse for it. Finally, we got a good, high resolution camera for 15, 16, and 17. Actually, Tom Stafford flew it on 10. But the so-called Apollo Television Camera that flew on Apollo 11 was terrible - low resolution, black-and-white. Just not any good at all. It couldn't take any kind of bright scene at all. On Apollo 8, we had to put every filter in the spacecraft in front of it just to take a picture of the Earth.
1410227||CDR|Getting color television on Apollo 10 was a personal crusade of Tom Stafford's. It was the first flight to carry color TV, and Tom had to lobby and push awfully, awfully hard to get it qualified and get it onboard. It didn't make any difference who you were dealing with, every time you wanted to do something like that - whether it was for scientific purposes or whether it was for PR purposes - there was always an element that thought you were doing those kind of things from a self-promotional point of view. What I don't remember was why the color camera wasn't lunar surface qualified for the first three missions. Television, and particularly high definition color television let people understand what you were doing or seeing from a scientific point of view - or from an operational point of view or in terms of sharing the experience. Television had a major impact of the space program and we should have started using it a lot earlier. On Gemini 9, the ground had little or no idea what I was going through up there. If they had been able to see, they could have been a part of it; they could have helped. We might have solved some of the problems right then and there in real time.
1411354||CDR|It seemed like it was a lot longer than five minutes.
1411432||LMP|The empty bags were stowed in the MESA and you would think that an intelligent human being would be able to grab the right one.
1411459||LMP|Once the samples were in the SCBs, that's where they were going to stay until recovery. In that way, if they wanted a particular set of samples, they would know which bag to get. Some of the samples would be in the boxes (meaning the SRCs), but a lot of them just stay in the bags until they got to the Lunar Receiving Laboratory.
1411526||CDR|This is a good example of how I had to move my arm forward and then back to loosen the arm bearing and get some momentum so that I could reach the diverter valve. If you tried to just sneak back there slowly, it was hard to do. It was one of the little things you did to adapt to the suit and the environment.
1412034||CDR|I don't think we had nearly as many acronyms in the Navy as we had in NASA. NASA won the prize. The Navy used them for the names of commands, like 'ComNavAirPac' which means 'Commander, Naval Air-forces, Pacific'. But I tell you, going down to NASA meant learning a whole new language: an acronym for everything. And for the longer ones, like LCRU, you just turned them into words and said 'Lacru'. It's funny, but a lot of acronyms became so much a part of the NASA lingo that if you stopped somebody and ask them 'What does LCRU stand for?', they couldn't tell you. People would know which box the LCRU was and what it did, but they couldn't tell you what the letters stood for.
1412254||LMP|This was the 'Dixie cup' sampler which I must have just grabbed and carried out to the SEP site without telling anyone. It held a stack of Dixie-cup-like bags on a long handle; and when you filled one and pulled it off, another one was ready to use. Again, the bags each had a metal ring and you clamped it down and twisted it and stowed it. Each of the bags already had a number on it.
1412705||LMP|The intent here was to drive along the antenna on a constant heading so that the SEP experimenters could have a bit of calibration data that would have been easy to analyze - had the experiment been working. I don't know if it was still working at this point, and we certainly didn't know that until we got the data back to Earth. As I recall, they got a little bit of information on this EVA and, after that, it just got too hot.
1413148|Lunar and Planetary Institute||Station 2 was located at the foot of South Massif near the southeast rim of Nansen Crater. South Massif is part of the rim of the Serenitatis impact basin and the massif was uplifted at the time of the basin-forming impact, so the rocks that form the massif must be older than this impact. A landslide in this region put boulders from high on the massif into reach of the astronauts. The primary purpose of this stop was to sample these boulders, which represent material formed very early in the Moon's history that possibly came from deep within the Moon's crust. In addition to collecting samples, the astronauts performed panoramic and documentary photography and made traverse gravimeter and electrical properties measurements. Station 2A was located about 600 meters northeast of Nansen Crater. Originally planned as sample stop number LRV-4, it was decided to take an additional traverse gravimeter measurement to check the gravity gradient between the South Massif and the valley. While off the rover, the crew collected four samples.
1413500||LMP|The drive up to the Camelot rim was a very gradual climb, unlike Cone Crater on Apollo 14 which was a crater on a knoll. The LM was probably on the ejecta blanket of Camelot, so it would have been hard to judge a change in slope. Generally, the terrain here was much flatter than on either Apollo 14 or Apollo 16, which were the highland sites. The average (vertical) variation at our site was perhaps a meter or a meter and a half; and there's one picture of the LM, taken looking back into the Sun, and there is a little low ridge blocking out the lower part of the LM.
1413615||LMP|The seismic charges had an Apollo Standard Initiator (ASI), which was the @alsjurl/tnD7141ApPyrotchnc.html"@alsjt>pyrotechnic initiator</a> they used for everything - for any kind of explosive bolt initiation, for instance. It was hooked up to a radio receiver and, at 90 hours, the timer moved a metal window from between that initiator and the charge. For half an hour after the window opened, the ground could send a signal to set off the initiator and, therefore, the charge. And, if it hadn't gone off in the half hour, then the window would close again and that would be the end of it. All of them actually did go off but, if they hadn't, they would have been safe sitting up there when the people from the Smithsonian went to collect them sometime in the future.
1413623||CDR|Jack had to lean over to get the charge on the ground. Of course, we were riding low to the ground, but he had to reach to get the charge outside the fenders and sometimes he probably grabbed the antenna on the charge to set it down. Then, when we started up again, I had to be very careful not to run into the charge and knock it over. With the front-and-rear, Ackerman steering, if you turned left away from the charge, rather than the rear wheels dragging, the rear wheels were going to turn right and maybe hit the charge; so I'd turn right to avoid it.
1413923||LMP|In the pre-mission photos we could only see the very largest boulders and I don't think we could see any around Camelot. And we couldn't have seen any out that far from the LM.
1414029||CDR|I don't remember if 'two-blocked' is an old Navy term or what. But it means 'I've got it all the way out, hell bent for fire.'
1414036||LMP|We were driving down-Sun and that made craters hard to see despite the relatively level terrain.
1414036||CDR|One of the advantages of being the Commander and driving the Rover was that you knew when you were going to turn. It's just like what might happen if I took you on an airplane and did some acrobatics. I would know what I was doing and could anticipate the maneuvers, but you might start feeling uncomfortable, not being prepared, unless I really tried to talk you through everything.
1414253||CDR|Bob and Jack were always bantering back and forth, from training right on through the flight. Although it was all meant in fun and they both had a sort of subtle sense of humor, the interruptions did sometimes bother Jack, particularly when he had something he felt was important to say.
1414419||LMP|The light-colored areas on the rim of Camelot turned out to be that way because of reflections off of all of the rocky material, rather from an albedo difference of the soil. And it may be that the regolith on the west side was shallower for some reason, so that more blocks were dug out there.
1414510||LMP|The presence of vesicles usually imply that the rock solidified in the top of a lava flow where the cooling is quick enough to temporarily trap the gas that makes the vesicles. The inner parts of the flow don't cool that fast and the gas usually has a chance to escape. And what I was trying to do at Camelot was try to see how many flows the crater might have penetrated. Was there just one flow top, or several? I don't think we really had the time to do that, even when we got back to Camelot at the end of the EVA; but if you could get out and walk around, that's what you would try to do.
1414511||LMP|I was trying to estimate the largest size of crater that had formed everywhere on the surface. And that's roughly a function of age. Because bigger impactors are relatively rare, the older the surface, the larger the saturation crater size.
1414821||CDR|We didn't go down in any big craters; this was probably a shallow depression of some kind.
1414826||CDR|The reason the roll seemed like it was a lot was because, in one-sixth gravity, you're not anchored down the way you are in earth gravity.
1415222||LMP|It was a puzzle, seeing apparent lineations on the slopes of mountains. Some people, as I recall, did some simulations, building models, putting random roughness on the surface, and then dusting them and moving the light around, and they were able to create apparent lineations just with light position. Generally, I think, people don't feel that they represent any underlying structure: it's just an accident of dusting and lighting. The massifs do have layers in them - layers of debris - and I think the fact that you see what appear to be zones of blocks at the top is probably a layer of relatively hard material. But they really are gross layers.
1415222||CDR|While we were in orbit, we looked at the landing site as much as we could, partly to update our position and partly to get a feel for what it was going to be like. I wanted to get a map of it in my brain so that I'd know where we were going. Of course, the valley went by very quickly, so it wasn't like we had a chance to study it for five or ten minutes. And sometimes, if you weren't right on top of the fact of when it was coming up, it would be gone. You'd miss it. Things aren't instantaneously recognizable from orbit and you have to know when to start looking and what you're looking for.
1415339||LMP|Secondary craters, formed by ejecta from other lunar impacts, have a much lower energy and they tend to be more irregular, more elongate, and may have a blob of material in the bottom. The projectiles that form primary impacts hit at about 20 km/s, and that's an explosion. Most of the ejecta leaves the Moon entirely; very little of it falls back on the Moon. At most, the stuff that makes secondaries travels half way around the Moon and hits at 1.5 km/s and doesn't throw ejecta very far at all.
1415758||CDR|The low-gain was mounted in front of the control stick at my right hand. Most of the time I could drive and manipulate the low-gain at the same time, reaching across with my left hand to move it, probably not with the greatest of ease, but I do recall being able to do that. But, you know, if you got too many things going and you were making lots of turns you just couldn't sit there twisting that low-gain until you got to some reasonably steady course.
1420043||CDR|I don't know what we're going to run into next in the transcript, but I remember that when we drove onto the light mantle, although we talked about being able to see it from a distance, the albedo change was so subtle we really had to convince ourselves that we were there. It wasn't like suddenly going from dark to light, it was just fine-grained, subtle changes.
1420329||CDR|We wanted to know when we were up on the white mantle and we expected it was going to be a very subtle change. Here, we could see it coming; but I distinctly remember that it was very difficult to find a definitive line between the light and the dark mantle.
1420949||LMP|Formation of the massifs was part of a dynamic process; and the hard layers represented by the blocks near the crest are part of the evidence of that process. You had a relatively flat part of the Moon which was hit by a great big impact. It was virtually a point explosion, just like a nuclear explosion; and then, whatever was there was folded back. And, at least with the big, basin-forming impacts, you had a lot of molten material that formed in the instant cavity; and that stuff probably moved outward, too. Dynamic pressure forced the molten material to flow up and out of the cavity and on top of the rocks that form the Massifs. And since the top layers solidified out of partially molten material, that may be partially why they're harder. And then, subsequent to that - although you're still talking about the first few seconds or minutes after the Serenitatis impact - you get these radial grabens that form due to the dilation of the area that's been impacted. Parts of the rim of Serenitatis fell and formed what's called a graben, and the Valley of Taurus-Littrow is one of those radial grabens.
1421520||CDR|You couldn't spent very much time sightseeing, and that's why Jack's doing most of the descriptions. Every once in a while you could steal a glance but, if you didn't get right back to watching where you were going, you'd get in trouble...especially the little craters.
1421715||LMP|In principle, the term 'gabbro' has no genetic meaning but, rather, indicates a crystalline rock composed of roughly equal parts of the minerals pyroxene and plagioclase. However, here we were seeing rocks derived from lava flows that were thick enough that the rock cooled slowly enough that millimeter-sized crystals formed. They aren't very fine-grained like most basalts that cool very quickly, but neither are they as large-grained as the anorthosites found at Apollo 15 which cooled much, much more slowly, at depth within the crust. And, of course, these rocks weren't the breccias characteristic of highlands material.
1421744||CDR|We were concerned about what we were going to find at Hole-in-the-Wall and what path we were going to take to get up the Scarp. I don't remember exactly, but I'm sure we must have looked at the Scarp from orbit.
1422058||LMP|Because of the stiffness of the suits, our field-of-view was pretty much restricted to straight ahead. We could turn our heads a little in the suits and could gesture with our arms, but even then, Gene could really only see a gesture if I made it with my inboard arm.
1422110||LMP|Lara is almost certainly a crater that pre-dates the avalanche. The avalanche rode over it and, indeed, in the good photographs you can see some subflows (secondary slides) down the slopes into it.
1423005||CDR|As I recall, from orbit you really had to look for the tracks. If you could find one of the very big boulders you could trace the tracks on the slopes of the massifs. On the surface they were relatively easy to see from the LM. I don't think most of them jumped right out at you because there is so much subtlety. But, especially if you could find a boulder, you could see the tracks pretty readily.
1423337||LMP|The printing on the map is not mine and I don't specifically remember changing the name; but I wouldn't be surprised if I oscillated back and forth between Amundsen and Nansen. Amundsen gets so much credit, at least in the United States, that I may have decided that Nansen was the unsung hero of Arctic exploration. Or, somebody may have pointed out that Amundsen already has a crater at the Moon's South Pole.
1423549||LMP|Nansen isn't actually an impact crater but, rather, is an anomalously-deep, elongated depression that is part of the trough. It isn't filled as much as other parts of the trough. From the gravity measurements we know that, just before the mare lavas filled the valley, the difference in elevation from the valley floor to the tops of the South Massif may have been something of the order of four to five kilometers. That is, there appears to be now about two kilometers of mare basalt filling the valley. Originally the elevation difference was even more than four or five kilometers because there is strong evidence that the mountains have been subsiding over time, enough so that you never accumulate a talus at the base. The evidence of this is the trough that runs along the base of the massif. If you imagine a steeply dipping-fault between the South Massif and the original valley and the mountain subsiding relative to the valley, then the fault tends to open and either the talus tends to accumulate or you get a trough or both. Most people think that, once those mountains formed, they stayed relatively quiet; but the trough implies that there's been activity essentially up to the present. Otherwise, you would have filled up those troughs. Essentially, the gap is opening up as fast - or faster - than talus is accumulating, from a volume point of view. The average exposure age of the talus material is very low and does not correspond to the age of the mountain. The mountain formed 3.9 billion years ago and the exposure age of the soils in the trough is a few hundred thousand years.
