1181753||CDR|I don't remember much about it, except that it was a buddy-breathing system - a set of hoses and stuff - that would let us share one of the oxygen supplies if the other one failed. It would have restricted our movements, but it also would have got us back to the LM.
1181753||LMP|It rings a very faint bell that we had something called a Buddy SLSS; and the fact that neither of us remembers much about it shows how much we felt we'd need it!
1181922||CDR|The flag that we took to deploy was the one that had hung on the wall of the Mission Control Center during all the landing missions. And we also had another flag, which we brought back to replace the one that we deployed at Taurus-Littrow." See NASA photo @alsjurl/a17/images17.html#S7338346"@alsjt>S73-38346</a> which shows Gene and Jack persenting the replacement flag to Gene Kranz in the MOCR in December 1973.
1182149||CDR|I don't know how deep it went, but deep enough that it was very firmly planted. Obviously, we hit something hard, momentarily, and then went through. Nothing's going to blow that flag over.
1182158||CDR|There were two sections to the pole: the bottom section which had a hardened top on it so that, when you banged it into the ground, you didn't smash it in. The top section just telescoped down inside the section you banged into the ground, and that held the flag. The flag was on a two-section, curtain-rod type thing that was folded up. You unwrapped the flag, swung this curtain rod up, latched it at roughly 90 degree angle to the pole, and then extended the outer part of it. The flag looked all wrinkled, because it was folded up all wrinkled.
1182246||LMP|You couldn't actually see your feet without bending over, but you could anticipate what was in front of you well enough. Going side-to-side or backwards, you just had to be sure there was nothing in the way.
1182823||LMP|This wasn't an unstable position because there was no tendency to fall over on your back; but you were straining to stay there. You were straining against the suit and that took energy. You had very little mechanical advantage over the suit and, any time you had to bend it, it was work. The Apollo suits were adequate, but there certainly needs to be a major engineering effort on new suits.
1182927||CDR|'O.K. Number Three Wire' is another naval-aviator, carrier-pilot's term. There's generally four wires on the flight deck and you can catch 1, 2, 3, or 4. Obviously, if you come out of a carrier landing alive, it's successful; but 'O.K., Three Wire' is a term the LSO (Landing Signal Officer) gives you if you just make a perfect, super landing aboard ship. He'll write down the wire he got; he might say, 'low in the groove, number one wire' or 'high and fast, number four wire' or 'slow at the ramp, number two wire' or 'FAB' - which means faster than a bastard - number three wire' or he could say, "OK, number three wire" and that's about as good a landing as you can make. Nothing compares to the challenge of a night carrier landing, not even the challenge of landing a LM on the moon. In a carrier landing, it's dark, you can't see anything, your target's moving around, and it's a small deck. Landing the LM, you've got lots of people helping you; and you've got ways to abort out of it. Anyone who has ever flown on a carrier will know what I'm talking about.
1182957||CDR|I had two watches: one inside my suit which I kept on Houston time, and the other on the outside which we started - probably at 12 o'clock - when we started the EVA and could compare with the planned times in the checklists. The timeline was important, and we tried to stay with it.
1183101||CDR|I had a firm idea in my mind about how I wanted to land. I wanted to bring that thing down as quickly as possible and then, when we got down within the 50 or 60 feet range, slow down to two or three per second and maintain two or three feet per second and a little forward velocity of a foot or so per second forward. You learned very quickly in the @alsjurl/LLTV-952.html"@alsjt>LLTV</a> that if you tried to get it down at about one foot per second, all of a sudden you started hovering, or maybe you put a little bit too much thrust in and you started going up a little. So I tried to keep going down.
1183725||CDR|At one time, I think there was a pulley we could use to lower the ALSEP to the ground. We probably took them off. I didn't like all that extra garbage; I thought we could handle things quicker without all those crutches. It was just a matter of wanting fewer things to mess with. But Jack found himself, as he said, 'in the hole' and had to reach higher than he wanted.
1183731||LMP|There were some pulleys originally, but we had more problems with them than they were worth. As it turned out, I don't think we had a great deal of problems getting the packages out.
1183819||CDR|This is a response to "should you send man or machine into space?" We've had a lot of controversy and comment on that over the years, and this was just a subtle little comment to reinforce man's usefulness in space, even for a seemingly simple operation.
1183854||LMP|Although we'd learned a lot of things from the prior crews, we'd never personally had a chance to do things in one-sixth gravity. One-sixth gravity is something you can take advantage of, and we learned very quickly. For example, because things don't accelerate as quickly, you just have more time to react. I often found that if I had something like the hammer in one hand, and I wanted to shift it to the other hand, rather than actually move my hands together, I could just flip it and catch it. Moving your hands together is a lot of work in the suit; but if you just flip something, that's not much work at all. Here, Gene may have instinctively done something the way he would have in one gravity and realized there was an easier way to do it in one-sixth gravity; or he just forgot - as I often did, and I think we all did in the intensity of the moment - what was the best way to do something.
1183941||LMP|In the early days of EVA training, down in Florida on a not-very-well-simulated lunar surface we had outside the simulator building, we were operating with air cooling; we were just forcing (chilled) air through the suit. I was responsible for orchestrating a lot of the training, and I remember for Apollo 12 I got increasingly worried about the heat loads that were building up during this EVA training in the pressurized suits. Even with the lightweight backpack, Conrad and Bean were working awfully hard and getting awfully hot, just as I had in running some of the simulations. I was afraid we were going to hurt somebody because some of these guys, probably myself included, once they got involved in a task, were the sort who wouldn't say 'quit' until they passed out. And we certainly didn't need that. So I started to talk with the support crew and basically asked them if we could figure out a way to use ice water in the liquid-cooled underwear. Several guys went to work on that and what they did was add a water hose to the air hose we were already using and connected it to the liquid-cooled garment and then carried around a supply of ice water on their own backs. It made all the difference in the world; it was still tough, but at least you didn't get overheated. So there was always a guy around carrying your ice-water supply, but they were very good at staying out of sight behind you, and you had to turn real quick to know they were there. And that's what I was talking about.
1183941||CDR|As I read through this, I remember seeing a book or an article that somebody put together about how, on Apollo 17, we were visited by an outer-space alien. They took our lunar surface transcripts and pulled out unique parts of them which made it sound as if we were referring to somebody else being there. I remember one thing in particular: (at the end of EVA-1 at 123:28:30) we had a piece of foam rubber or something crack and sort of blow up in the sky, and I said 'What's that?' And here, I'm saying, 'Hey, you notice there's none of those guys up there holding those hoses.' And we go around the LM and Jack says, 'What do you mean? I just saw one a minute ago.' And these people, or this guy, took these kinds of things out of our transcripts, out of context, and put a whole story together that was almost believable. If I hadn't been there myself, I would have thought that an alien spacecraft landed next to us and these comments were referring to that. It was amazing what you can do with editing.
1184113||CDR|This was not an old joke; but here I am, on the lunar surface in this big, mountainous terrain, and he's telling me it looks flat and smooth!
1184407||CDR|In listening to the tape just now, I knew before he said it that Bob was going to come back with 'Hello, Challenger.' That's just typical of both Jack and Bob: playing verbal games, having fun.
1184657||LMP|The fuel element was in a graphite capsule hanging on the outside of the LM next to the ALSEP stowage area. You tilted it down to a horizontal position so that you could get at the @alsjurl/rtg.cask.detail.jpg"@alsjt>dome</a> to get it off. The theory behind the capsule was that, if you had a breakup during launch or a re-entry because of an accident in orbit, the capsule would separate and re-enter intact so that the element itself would not be exposed and put plutonium into the atmosphere. So you had to take the capsule apart by taking this dome off; we had a special tool to do that and another tool to latch onto the fuel element and extract it out of the graphite capsule. I don't think there were threads involved in the dome removal. If I remember correctly, it had three prongs and pins and you put them in slots and you screwed the pins in and that released the catches that were holding the dome in there. Clearly there was a turning that was involved and something had gotten stripped.
1184724||CDR|To get the fuel element out, you tilted the cask and used this removal tool. You didn't want to get too close to the fuel, because it was radioactive (and, more importantly, was thermally hot enough to damage the suit); so, once you had the dome off, you would use the tool to pull the fuel element out. Well, with the dome threads stripped, we were going to have to use the sharp point of the hammer to pry the dome off.
1185107||LMP|The ALSEP turned out to be a lot harder to carry than you would have imagined, mainly because your forearms were already tired from doing so much work. You had to grip that handle and carry it some 300 feet to a reasonable site and that was almost the last straw; you didn't know if you were ever going to recover and be able to use your hands again. It weighed about 350 Earth-pounds. On the Moon it was only 60 pounds; and the problem was gripping that handle of the barbell.
1185150||LMP|Recently, a lot of us have been trying to figure out why it is that, when you stir up the surface near the LM, it seems darker while, away from the LM, you don't see that. And my conclusion at this point is that the winnowing effect of the descent engine effluent increases the frequency of small rock fragments compared with dust in the area around the LM, and that, in turn, results in a higher than normal albedo. Rock fragments give you a higher albedo than the dust does. And so, when you walk over it and stir it up, you bring up the normal regolith on top of this winnowed material. And as you move farther and farther away from the effects of the descent engine, you see less and less of that happening. The samples taken near the LM and underneath the LM never showed any chemical contamination or any other reason for that lighter-colored albedo. Yet the visual effect was so marked that you could see a landing site from orbit. We could see ours after we were back in orbit, and we could see Apollo 15 when we flew over it later in the mission.
1185308||LMP|This 'mottled' appearance was probably the result of the small, whitish halos that were produced around every one of the micrometeorite impacts. The shattering of the plagioclase made it lighter colored that it had been to begin with.
1185443||LMP|Walking down-Sun, the swale wasn't obvious until you got there. Looking up-Sun from the other side, it probably was fairly obvious from the photometric shading that occurs when the sunlight strikes at a glancing angle.
1185443||CDR|I don't remember noticing the swale during the descent. And if I did, it wouldn't have bothered me. All it would have done was pitch us forward a little bit, and what I was really looking for was the holes and boulders.
1185610||LMP|These were gross-leveling blocks. The idea was that, if your site wasn't quite flat, you could put one under a corner of the ALSEP package and get your initial level. Why we ever had them I'll never know; there were always plenty of rocks you could use. People working in a non-real environment came up with the idea.
1185741||LMP|The pinkish color could be the result of one of two things. Any exposed rock surface has a thin patina or coating that looks a little like desert varnish. However, desert varnish is caused by chemical precipitation, while this is a thin, semi-continuous splattering of brown glass from the micrometeorite impacts. The patina may have looked pinkish to me at this point. Or, the clinopyroxene in the rock might have been giving it a pinkish cast in the full Sun.
1185741||CDR|Because there was dust on everything, once you got a piece of tape off the roll, the first thing the tape stuck to was dust; and then it didn't stick to anything else.
1185814||CDR|The suit made using the tape more difficult than it would have been otherwise. You don't have as much dexterity with your hands and fingers to get the tape off the roll and tear it. We used the old trick of folding over a little piece of the end so that that piece wouldn't stick back on the roll; otherwise, you'd never get it off.
1185931||LMP|Through the years I had deployed versions of the ALSEP enough times that the geometry was pretty well fixed in my mind. I could look at an area and, in my imagination, place where everything was going to be and try to pick a compromise site. Nothing was going to be perfect; there were too many variables. But it's one of those things that you can do fairly easily with enough practice that would also be tough to automate. The main problem with the ALSEP was that it took a lot of time to deploy. Much more than it needed to had we designed it to minimize time initially. It got off to a bad start and never fully recovered. Before my time, Walt Cunningham had told the Bendix people 'Give us something to do on the Moon.' And they did. The other extreme was when Bill Anders saw it and said, 'I want a big red button and when I punch it, it gets deployed.' And we ended up in the middle somewhere, still taking an awful lot of time and effort to deploy it. Not the best use of human time on the Moon. Deciding where to deploy is a good use of people; but the actual deployment should have been far more straight-forward than it was.
1190449|Lunar and Planetary Institute||The Apollo Lunar Surface Experiments Package (ALSEP) was deployed approximately 185 meters west-northwest of the lunar module. The experiments on this mission were the Lunar Seismic Profiling Experiment, the Heat Flow Experiment, the Lunar Surface Gravimeter Experiment, the Lunar Ejecta and Meteorites Experiment, and the Lunar Atmospheric Composition Experiment. A deep core sample and a Traverse Gravimeter Experiment measurement were also taken during the ALSEP deployment. Deployment went normally for the most part; however, extra time was required to level the central station and antenna and to retrieve the drill cores.
1190705||CDR|We had the low-gain antenna set up with a heading indicator; and we'd done some work with it in training. I knew generally what my heading was going to be, and in this case it was going to be west. So, rather than try and sight the antenna while I was going, in this case I just set the low-gain on the 270 mark. I never had to worry about the elevation because it was just about always the same no matter where we were.
1190916||LMP|Because the RTG was producing power when we hadn't yet hooked up any of the equipment, they had what was called a shorting plug that basically allowed current to flow out of the RTG and then back into itself. And, obviously, some resistance had been put somewhere in the circuit it made so that the power source wouldn't burn itself out.
1190937||CDR|As I remember, if I was at the front of the Rover facing the back, the battery covers would open toward me. So if you parked the Rover facing east, the covers would shadow the batteries from the Sun and let them cool.
1191413||LMP|We established one place in the deployment site where you'd put all the discards, all the things that were designed to isolate vibrations, to assist in packing: shims, dust covers, and other things that people felt were necessary to protect the equipment. The idea of having a garbage pile was partly to keep the site neat, but also to keep things from being under foot. I'm throwing things toward the pile and often not hitting it, usually throwing things too far.
1191445||LMP|This statement seems to imply that during training it was hard to get the pins lined up. But, apparently, perseverance succeeded.
1191627||CDR|It felt like a shot of ice water.
1191759||LMP|In those days, they were saying that the missions each cost a half billion dollars, half for the hardware, half for operations. If you spread that over the two of us being out on the surface for twenty-two hours, it comes out to about $200,000 per EVA minute.
1191827||LMP|We had originally had things called Calfax fasteners holding the equipment together, but they were far too complicated. I made a stink about that early on, way back in the mid-sixties. So they invented or found another way to do it and replaced all the Calfax fasteners with these @alsjurl/alsj-BoydBolts.html"@alsjt>Boyd bolts</a>. The Calfax you had to turn several times; and these you only had to push in with the UHT and then turn a three-quarter turn and it would pop loose.
1191827||LMP|The change from Calfax fasteners to Boyd bolts occurred well before the first ALSEP. We changed that at Bendix as soon as I got involved. As I've already mentioned, Walt Cunningham, on a visit to Bendix early in the history of the ALSEP program - not knowing that there was going to be lots of things to see and do and describe and photograph - told them to give us something to do. So Bendix put as many fasteners on this thing as they could. But when Bill Anders and I showed up there - probably in '67, maybe late '66 - we saw this monster that they had constructed with over fifty of these Calfax fasteners. I think it took two-and-a-half turns on each of them to get them loose. So we yelled and screamed. Well, not 'yelled and screamed'; but we suggested to them that they try to find a better fastener and reduce the number as much as they possibly could. To be fair to Bendix, the contractors sometimes had a hell of a time responding to astronaut inputs. They felt like they ought to respond and so they had responded; and then the guy who made the input disappears - Cunningham was off working on Apollo 7 by this time and was out of the picture - and a couple of more come on who have different ideas.
1191827||LMP|On my first visit to Bendix in Ann Arbor with Bill Anders - we flew up there in a little T-33 - I think we went through a shirtsleeve deployment of the mock-up that they had at the time. And that's when we just about raised the roof on how long it was going to take and how much was required physically. We really forced them into a whole re-design on the packaging and deployment. The issue of the fasteners is the one that sticks in my mind because they were so egregious, but I'm sure there were lots of other change orders written. I spent a lot of time trying to work with Bendix because I didn't want to use up any more time deploying the ALSEP than was absolutely necessary. There were so many other things that I wanted to do, and wanted the rest of the guys to do - mostly collecting samples - that I wanted to minimize the amount of time we spend on the deployment. Deploying the ALSEP is exactly the kind of thing that robots generally ought to be used for, except for certain things like getting seismometers deployed and leveled. Things like that are tough to do automatically and is probably cost effective to have a man do it. But a lot of this other stuff could have been done robotically, even in those days. It's just that the program didn't try to do it that way.
1191955||LMP|As I recall, in order to train with the drill, you wanted to drill in a lunar soil simulant. So we had a big can or drum or bin filled with the stuff - dry and tamped down - and when we got to this point, Gene would go over and drill his hole in the can of simulant.
1192212||LMP|There was a level bubble and a little gnomon, and I would have seen movement too small to see in the TV picture.
1192224||LMP|As I remember, it did partially uncage and, eventually, they learned how to use the instrument as a seismometer.
1192240||LMP|Because we were at 23 north latitude, and because the Sun was already up maybe 8 to 10 degrees, it wasn't exactly east of us. There was probably a mark on the device that took that into account and showed me how to place the gnomon shadow so that the whole experiment would be properly aligned relative to east-west.
1192303||LMP|Generally, you didn't want the cables taut but, rather, with a bit slack so that they could drape over craters. But you also didn't want them to drape over rocks.
1192653||LMP|I don't recall that we had developed any contingency plans for walking traverses. I think the idea was that, if it ever came to that, you'd develop plans in real-time, depending on what you'd gotten done before the Rover failed. With all the redundancy built into the Rover, and with two successful Rover missions completed, they figured that it wasn't much of a risk. If we'd had to, I think we could have probably gotten to our main objectives almost as fast loping as we could driving. You could move pretty fast, and it wasn't an effort, that I recall. I don't think they would have let us go all the way to Station 2, but I think we could have made it up the Scarp. It would have been tough climbing, but we probably could have done it climbing sidehill, zig-zagging up. The main problem was the lack of flexibility in the hip. It wasn't hard to stretch your leg, but lifting your thigh was difficult.
1192740||LMP|The Support Crew had all sorts of clever little sayings and pictures and stuff like that that they would put into the checklist. Bob's favorite, since our motto was 'the end of the beginning', was 'this is the end, not the beginning'. And he had some little pink patches he called "Rover patches" as distinct from the flight patches; and there may have been something like that in the checklist at this point. Some of it you couldn't repeat over the airway. Or maybe this was just another part of the private joke.
1192843||LMP|The legs on Gene's drill-stem rack were packed unextended and when you extended them, they popped out with a spring. In training, they may have actually fallen off.
1193007||LMP|I was probably supposed to put the UHT in a socket and rotate it; the instrument was probably locked unless you put the UHT in and rotate it. Obviously, I had forgotten to do that in training and had forgotten again on the Moon.
1193049||LMP|We had done the deployment often enough in training that I had a feel for how far away he was supposed to be.
1193200||LMP|This was probably a safety seal that held down the cover on the port. I had to remove it so that, when they later sent the Open signal, the screen would come off. You'll notice that I've moved well away from the LMS by this point. Often we did that - wait to brief them on something that had already happened - because it wasn't convenient to break in.
1193234||LMP|I may have been in a deeper depression than I had expected, although the pictures certainly don't show anything dramatic.
1193353||CDR|Because of the weight of the PLSS, you had a tendency to lean forward and put a little torque or bending motion on the drill stem. The worry was having it bind up as a result.
1193353||LMP|There may also have been some consideration of optimizing power usage. The motor would have been more efficient at medium power levels than at higher power levels.
1193354||CDR|Thinking about when I said 'it sounds like she's chipping away', you have to remember that sound and feel are very closely related, just like in the lift-off of the Saturn V. Do you "hear" the noise or do you "feel" the noise? In this particular case the "noise" or the vibration traveled from my hands up into my suit. So was I hearing it or was I feeling it. Probably feeling it; but sound and feel are very closely related when you're in an environment like that.
1193525||LMP|In drilling those holes, it was nice that fifty percent of the regolith is particles smaller than 100 microns. The chances of hitting a large rock were pretty small, in spite of what you see scattered around on the surface. Because you're looking across the surface at a very low angle, you get a distorted view of how many rocks there are.
1193708||LMP|By leveling the Central Station and getting it aligned relative to the Sun, I could then use pre-determined coordinates for pointing the antenna.
1193714||CDR|We knew they were watching a lot of things on the television, so when we made a statement, we didn't necessarily make a complete statement because we knew they're looking at what we're talking about. In this case, I was talking about the difficulty of getting the wrench off.
