1503207||CDR|I think our computer-based inertial navigation system was the state-of-the art. It ended up in 747's flying across the Pond (usually the Atlantic Ocean). We'd write the software for the different missions and it would take hours and hours in the simulator to wring out all the bugs in it before you would have a level of confidence in it that it could be declared operational. It's obsolete equipment today but, as far as I know, there was nothing comparable at the time in military or commercial aviation.
1503536||LMP|I was working a lot with my gold visor halfway down, just so I could see better. And they got confused when Gene or I made a comment some other place that the sunshade wouldn't come all the way down.
1503700||LMP|If we had seen 'bedded spatter' or some other clearly volcanic-looking material, they would have sent us back to Station 4. If there was any indication at all that it was a volcanic cone, we would have gone back there.
1504037||LMP|Almost certainly, I was surprised - and I think I recall it now - that they didn't want to ask more questions about EVA-2. More than likely, there were lots of questions; but the Flight Director was saying 'We've got to get them back on the timeline and get them to sleep.' We did a lot of geology debriefing when we got home but, unfortunately, we can't find the tapes or a transcript. I sat with Lee Silver and probably Muhlberger and Swann and others and recorded a lot of extra debrief.
1504201||LMP|After EVA-3, you were getting ready to go home, you'd done what you'd come to do so why worry about getting your full eight-hour rest period? You don't need eight hours of rest anyway; five was plenty, I think, for both of us. Plus, we were going to spend three days in orbit after rendezvous, so there wasn't going to be any hurry. So I think Gene was just trying to discourage them from even thinking about shortening the EVA.
1504256||CDR|We had five and a half hours to get prepared from the time we woke up to the time of lift-off and that was an enormous amount of time. We could have pushed the third night's sleep back and gotten up an hour later. And, if we did shorten the sleep, once we got back in the Command Module we could make it up.
1504256||CDR|I've said that I thought sleeping on the Moon was a big waste of time. We needed physical rest, we needed to get out of our suits, but I really wish we'd had more time to absorb what was going on. There's no human being who can consciously take in all of an experience like that while it is occurring. Subconsciously, you do retain things that you weren't aware of at the time and it takes a while for those to come out. You have to be careful that you don't develop a convenient memory and have things come out the way you might like to have them come out or in a way that makes you look like you had all the right answers beforehand. It's a very dangerous trap that you can fall into. So I wish we'd had more time to absorb things. But we had no choice; we had to rest and, as crew commander I had to maintain some discipline in our relationship with the ground. We knew we had some padding in the schedule, we knew we could go out a little longer, we knew we could sleep a little less; but the eight hours was important because, although we really only slept about four hours, we needed to think and talk and rest.
1510225||LMP|Because we spent at least a couple of hours on the Rover on this second EVA, clearly we didn't stress ourselves as much as during the first day. And we were more familiarized, so there was less emotional stress than on the first EVA, if there had been any at all. And I'll tell you, I never remember feeling anxious about anything except about the timeline and being able to get things done.
1510303||LMP|Joe was joking here. He was going to ask how hard the Rover worked. That's the way Joe thinks.
1510303||CDR|Our rates weren't all that different. (Laughing) Of course, I had to expend a lot of my energy getting Jack all squared away, so you'd probably want to take about ten percent off of my average and add it to his. I had to get his valves turned off, shove him in the hatch, help him on the Rover, pick him up when he fell. So, realistically, we've got to take that into account. (Somewhat more seriously) My rate while we were driving was about ten percent higher than Jack's and maybe that had to do with the fact that you're not a casual driver on the Rover - you're involved all the time. And I've got to believe that that shows up as an expenditure of BTU's.
1514233||CDR|I sound a little tired. It was the end of a long day. During these long periods of silence we were probably eating something, packing things away, and cleaning up a little bit. Sort of relaxing a little bit and doing our own thing; letting them know, every once in a while, where we were. And they were leaving us alone to get things prepared for our rest period. It was good. You need that kind of time.
1514821||LMP|This was one of the few chances you had to reflect a little bit. This was just a gradual wind-down from the long day. While we were filling the PLSSs and doing the other things, Gene and I chatted, mostly about what'd we'd done rather than what we'd seen. And often, I think, we were speculating about the kind of things the ground might recommend. I wish we'd talked more with the ground about the geology, but I also understand the Flight Director's position.
1521808||LMP|Gene got his @alsjurl/a12/a12.hammocks.jpg"@alsjt>hammock</a> up first and got in it, then I put mine up and got in it. There wasn't much spare space. The suits were on the engine cover under Gene's hammock and, as I recall, the helmets and visor assemblies were way at the back, sort of under the suits.
1522409||CDR|It was easy to get philosophical. I've said before that I've always felt that sleep was one of the greatest wastes of the short time we had on the Moon. You're only there for 75 hours and you sure don't want to waste twenty four of it sleeping or resting. You'd like to be doing something that would allow you to go further in learning and exploring. And, yet, you had to rest if you were going to take advantage of your physical and mental capabilities the next day. Each EVA you became more tired and you began to sleep. When I slept, I slept pretty good. I don't know, maybe I got three or four good hours of sleep. So a lot of the time you'd just lay there and think. Just before you'd gone to bed, you'd look out the window and see the flag and the Massif and the Earth. There you were, a quarter of a million miles from Earth, laying in a hammock in a little tin can. 'Here I am; I'm really on the Moon. What should I be doing that I'm not doing? How can I take advantage of this? Is it real? Is it a dream?' I've always said that looking back at Earth was a link with reality from a place that was almost like a dream. During the rest of the mission you get caught up with all the things that you've got to do: checking out the PLSS, checking out the LM, doing the geology, driving. You get so caught up with what you're doing that you could be almost anywhere. So you've got to take time out sometime during the mission to think about where you are and what you're doing. You could do a little of that during the EVAs themselves. While Jack was dusting me off I could take a look around at the Massifs and the flag and the Rover and it was a pretty big chunk to swallow. So it was easy to get philosophical.
1602634||CDR|This was probably the first time I'd heard the Aggie War Hymn in my life and it really didn't impress me all that much. You can tell that in my tone of voice. So when I said 'I want you to say it first,' I meant 'Whatever you're going to say, let's get it done and over with.' I wish I knew what Jack thought of that.
1602640||CDR|Gerry went to Texas A&amp;M and he's a big Aggie (supporter). Now maroon is an Aggie color, but orange happens to be a (University of) Texas color. A&amp;M and Texas are always at odds. If we had found blue dirt, it would have been better than finding orange dirt. That's a big deal around Houston.
1602640||LMP|There were a lot of Aggies in the Control Room, but Gerry Griffin was the head Aggie.
1602720||CDR|Sometimes you're asleep and it's the wake-up call that gets you up; and other times you're up and taking care of things without bothering the ground. Here, we'd had a couple of hard days on the Moon and had one day to go. The adrenaline probably started pumping a little while later; but I would expect that a little bit of the edge had worn off. We were pretty tired, physically, at the end of each one of those days, and you don't get the best rest in the world in a situation like that. You rest and you sleep; but you lay there half the time asking yourself if there isn't something else you could do instead of try to sleep. It was enough sleep to keep you going, but I don't know how good a rest it was. I probably had my comm helmet hanging up next to my hammock and, when Gordo called, sat up Indian style. One-sixth g gave you some facility to move around, even in those tight quarters.
1604424||LMP|I remember that Gene was looking at the Earth through the rendezvous window. You couldn't see it out the front unless you got down and most of the time we were standing. The suits were on the engine cover, so you'd just stand and lean. In one-sixth g it was no big deal to stand forever.
1604424||CDR|There wasn't much room to sit anywhere, except on the suits, and that was one thing we didn't want to do (because of the danger of getting dust into the zippers and rings.)
1604507||LMP|I doubt if anybody on the Moon would have told the doctors if there was a problem, just to make sure that there would be no glitches on getting out for the third EVA. Our hands and fingers were sore from the lifted fingernails. If you touched them, they were very sensitive. I don't recall that there was continuous ache. I think it was only when you hit your nails on something. I wore @alsjurl/glove.jpg"@alsjt>thin nylon liners</a> in my gloves to try to protect my fingernails. Without the liners, I was uncomfortable with my sweaty hand against the rubber. We didn't have the water cooling out into the fingers - just up to the wrist. You're hands didn't get hot, but you did perspire.
1604507||CDR|As I've said, I don't remember my fingernails giving me as much of a problem as blisters on my knuckles. I've got such a fat hand. But I do remember that the lunar dust penetrated well down into the quick. It took three, four, five, six weeks for the lunar dust to grow out. So the dust was able to get in there; I just don't remember any pain from the fingernails being lifted off. My main recollection is of my knuckles being rubbed raw.
1604511||CDR|If you go from the extremes of the first EVA to the third EVA, I can tell you that when I was working with my hands out in the Sun, I could feel the heat penetrate during that third EVA that I could not feel during the first EVA. Sun angle did have a significant effect. I don't know if the data show that we used more cooling in our PLSSs during that third EVA.
1604659||LMP|The Lunar Orbiter team discovered mascons in the Doppler tracking data. They found that the lunar gravitational field is not uniform; and, specifically, that there are concentrations of mass under the most circular - i.e., the youngest - of the large basins and mass deficiencies under the rims of those basins - notably Serenitatis, Nectaris, Crisium, Imbrium, Orientale. The computer model that fits is one that has the mantle of the Moon - at about 60 kilometers depth - slightly raised under the basins and with a bit of a deficiency around them. It's like an incipient water splash. The rebound from the impact that formed the basin has caused the mantle beneath the center of the impact to rise slightly. Plus, the effect of that little rise is accentuated by the flat plate of dense material represented by the lunar mare. As I remember, the lunar mare has density of about 3.4 grams per cubic centimeter, whereas the surrounding highlands have a compacted density of about 2.9. So it's a significant contrast. One of the more interesting aspects of it is that the old, irregular mare basins don't have mascons. And that suggests that between the formation of the old, irregular basins and the young, circular basins, something fundamental changed in the lunar crust. It became stronger - a lot stronger - so that, in the younger basins, there was no compensation for (or relaxation as a result of) these density differences as apparently there was early on. And the change presumably occurred over a fairly short period of time around 3.9 billion years ago when most of the young, circular basins formed. There's a lot of controversy raging about whether all of the 45 to 50 basins formed at just about the same time. I'm of the belief that that can't have happened, in part, because you have this very distinct strengthening of the crust beneath the mascon basins.
1604659||LMP|The flight dynamics people anticipated that, because of the micro accelerations and decelerations associated with the mascons along the path of the Command Module, you would get a perturbation of the orbit. So, after Ron dropped us off, he had a burn that put him into an orbit which, upon perturbation, would become a 60-mile circular orbit by the time we were ready to launch. They thought they could predict how the mascons would perturb the orbit - clever people, these Americans - but the mascons wouldn't co-operate. Their gravitational model was not sufficient to make those predictions. The main reason (for the inadequacies of the model) was that they couldn't track spacecraft as they orbited over the Farside and, consequently, they didn't have any information about Farside mascons. One of my reasons in proposing a Farside landing on Apollo 17 - when I tried to persuade NASA to let us land in Tsiolkovsky - was that you'd have to put together a communications system; and that would allow you to track the Farside orbits and gain additional knowledge about the Farside mascons. I suspect that there aren't very many. Tsiolkovsky is probably one of the few, because there just aren't many young, fresh, circular basins on the Farside. I suspect they've all compensated except for Tsiolkovsky and one or two others.
1604659||LMP|After the crew was finalized in the fall of '71, for the second time I tried to persuade Chris Kraft and others that we ought to consider a Farside landing. I had brought it up before - after Apollo 13 - as the culmination of the last four missions going to the places where everybody always wanted to go: Tycho, Orientale, the North Pole, and the Farside. I had fun trying to justify that mission to people. But everybody was so wrapped up in proving that they could survive the Apollo 13 failure and get Apollo 14 landed, that it didn't get much play. I worked it for a while, anticipating that just one more landing wouldn't help the politics of the space program very much. I wanted to build up to some sort of crescendo that would not only provide good science but would provide public interest. When I brought it up again in August or September of 1971, I went so far with the Lunar Mafia - the group of people at JSC who thought up these 'dumb' things to do on their own time - as to work out how to do it. Some of the guys in Flight Control were able to track down a couple of on-the-shelf Tiros satellites that could act as communications satellites. The plan was to place those, with a single Titan launch, at the Farside libration point. There's a libration point about 30,000 miles behind the Moon where things will stay, at least for a while, if you put them there. Except in very weird circumstances, satellites at the libration point would give you a direct link with Earth; and the two satellites gave you redundancy. It was a great plan. TRW quoted a price of about $80 million and I had added a $20 million contingency. And we had other plans. In one, as you went around the Moon in the Command Module, you'd drop off a bunch of small communications relay satellites, rather like the current Iridium scheme. (Laughing) But, finally, Chris called me in and said 'Shut up; quit talking about this. We're not going to spend a hundred million dollars to put a communications satellite behind the Moon for the last mission.' I'm not sure where the numbers came from, but the marginal cost of building the hardware for an Apollo mission was about $250 million and I was told that operational costs - to run the centers and the tracking stations, etc. - were about the same number.
1604659||CDR|Aside from the cost and the probability of having to delay the flight, management simply wasn't going to take the risk of sending us to the back side of the Moon. It would have been a challenge and would have been worthwhile doing, but we still had a lot to learn about the front side. I was involved in discussions at the level of Chris Kraft and George Low and it quickly became obvious that it wasn't going to happen. Jack used to go on crusades like this and get other people involved and go into the details of how to do it and what it was going to cost. And that was good. But Jack used to have the habit of pushing people and pushing people without knowing - politically or diplomatically - when to quit. And, finally, Chris got fed up.
1604838||LMP|The normal rendezvous procedure was for the LM to be active and rendezvous with the CSM. And a CSM rescue would have been the case of where, for some reason, all the LM could do was get to orbit; and then it would have been a CSM-active rendezvous which would, of course, have taken lots more CSM fuel.
1604838||CDR|The LM had to get into some minimum, sustainable orbit. For a normal launch time, most likely it would have been a fuel problem that would have forced a Command Module rescue. For example, if your ascent engine shut down early and you got close to orbit and you had to expend most of your RCS fuel to get into that sustained orbit then, obviously, you would have done it. You would have used all the fuel you had to get into orbit; and then you'd rely on the Command Module to come get you. I always felt that a Command Module rescue was a remote possibility, although one that you had to maintain a fuel reserve for. The reason I say that it was a remote possibility is that, in most cases, you would have done the rendezvous even without the radar. The Command Module had a Doppler device and other systems to give us information and there was manually- and computer-derived information. The LM was a much better rendezvous vehicle than the CSM and, unless there was a fuel problem, there was little chance of having to do a Command Module rescue. And, even in the case of a fuel problem, the chances of you getting just high enough that, if the ascent engine shut down early, you had enough RCS fuel to add the amount of velocity to get a sustained orbit were small. You had to get into an orbit that wouldn't decay in five or six revs. And if you only got into an orbit that would decay in one or two revs, it would have been all over. The rescue was a time-consuming process. Now, for an emergency situation - which I always thought would have to have been a fairly catastrophic situation - it would have been a manual launch because of the inertial navigation system being powered down. You couldn't sit on an emergency on the lunar surface, but you could sit on an emergency once you got into orbit, because the Command Module did have that capability to come down and get you.
1604838||CDR|Of course, there were other reasons why we might have had to leave the lunar surface early. We could have been perfect but there could have been a problem with the Command Module which said 'guys, the Command Module's going to have to go home pretty quick, so you'd better get your ass off the lunar surface and get back there or he's going to go home without you. God forbid there had been an Apollo 13-type problem while the Lunar Module was on the surface, because I don't think any of us would have gotten home. But there might have been some other kind of problem in the Command Module: Ron could have gotten sick, a fuel cell could have gone out, you could have lost redundancy in your ability to start the Service Propulsion engine. And I guarantee you that, if you lose the redundancy to fire that engine, the ground is not going to allow you to stay there for three days. They're going to take you off the surface, you're going to rendezvous, and your going to come home. So it wasn't just a potential problem on the surface that we had to be prepared for; it was the other spacecraft as well. And that's always going to be the case with lunar travel. You've got to look at the entire system, not just at yourself. The suits, the backpacks, the amount of fuel you're using. One effects the other. If we'd blown one of our suits for some reason, had gotten in safely, and had gotten back to orbit but with only one good suit, we would have blown Ron Evans' EVA. With only two good suits, you couldn't depressurize the Command Module and all of that data that Ron had up there (in the SIM Bay) would have been lost. It wouldn't have been an emergency situation, per se, but it is typical of how interdependent the two spacecraft were.
1612348||LMP|What comes to mind is that the bags for each meal were stacked together and taped. So what I was probably using was that tape. It was tape on plastic or whatever those bags were made of; so, when you pulled the tape off it was still good. Boy! I'd forgotten that that was what I used. But it certainly was better than grey (duct) tape because it was thinner. And the grey tape may have still been out in the Rover, anyway. Actually, I'm surprised that the ground hadn't come up with a fix, because that was a major deficiency in that second EVA.
1612856||LMP|The surface of the dark mantle at the 17 site looks young relative to the age that was actually measured because it such fine-grained material. When you get an impact you may get a little of the regolith breccia - that we used to call 'instant rock' - but, for the most part, you're just distributing fine-grained materials - the Dunkirk Effect. You form a crater and then the crater subdues immediately because of the slumping of the fine-grained material. In World War II, when the Germans tried to bomb the British Expeditionary Force that was evacuated from Dunkirk, the sand absorbed the effects of their bombs. Unless they got a direct hit on somebody, very few people got hurt. If the British had tried to evacuate from a rocky coastline, they never would have made it. I just coined the name: the Dunkirk Effect. I don't know why I thought of it; but, basically, the impacts in the mantle were hitting into a great big sandpile and, unless they were really big ones and were getting down to the underlying basalt and threw up some rocks, the craters were not going to look fresh in the terms that we think of when they hit hard rock. The age of a surface is based on the number of craters that you see and, in this dark mantle, craters three to five times the thickness of the mantle tend to disappear very fast and not even be counted. So you count fewer craters of a given size. If you could do it accurately, you'd probably see a knee in the curve. In the large crater fraction, the counts would match the old age. And then there would begin to be a fall off as you got smaller and smaller.
1613004||CDR|This is typical of Parker and Schmitt. Jack would normally elaborate and this abrupt "Yes" was his way of getting back at Bob.
1613601||LMP|We hadn't planned to range along the base of the South Massif and didn't. And, in retrospect, we didn't do too badly in getting a fair variety at Station 2. Each of the three or four rocks we looked at in some detail was different. What we didn't get was which one was most representative.
1614117||CDR|During these long comm breaks we were just busy doing things. You could always listen but, unless you were on VOX, it was sometimes inconvenient to key the switch to tell what you were doing. It was more efficient to just get it done. You know they're there and that you can talk to them if you need to.
1624953||CDR|My PLSS was stowed on the port bulkhead at my left shoulder with the (U.S.) flag outboard so that I could just back into it. I'm almost positive that Jack's was stowed on the floor by the hatch with the flag up and the surface that interfaces against the body down against the deck. There were some interim stowage bags hanging in front of the Commander's PLSS which we just threw in the back to get them out of the way.
1625454||CDR|He had a signal strength meter and control knobs for pitch and yaw so that he could tweak up the signal. He must have hit one of the knobs.
1625846||CDR|On the surface, our antenna pointing didn't change but, throughout the flight when we changed attitudes, they would give us pitch and yaw for the (high-gain) steerable. This was true in the Command Module, too. If we were behind the Moon, they'd have given us a pitch and yaw so that when we came around the limb, we'd pick them up immediately.
1630040||LMP|All through this prep, it sounds like we had a pretty good rest. Compared with how we sounded at the end of the second EVA, it had obviously done us some good. Geno may not sound as rested as he has at other times, but I sound pretty normal.
1630040||CDR|- (Tongue in cheek) "Once you experience the responsibility of command, you realize that you never get as much sleep as the crew does. The crew's welfare comes first, before your own personal comfort.
1630835||LMP|There were two settings on the valves. Low Flow was for make-up and High Flow was for use if you had a hole in the suit.
